chromosome,st_bp,end_bp,length_kb,cnv_type,overlapping_genes
1,9009,860859,851.85,del,"DDX11L1, DDX11L17, FAM138A, FAM138C, FAM138D, FAM138F, FAM87B, LINC00115, LINC01128, LINC01128, LINC01128, LINC01128, LINC01128, LINC01128, LOC100132062, LOC100132287, LOC100288069, LOC101928626, LOC729737, MIR12136, MIR1302-10, MIR1302-11, MIR1302-2, MIR1302-9, MIR6859-1, MIR6859-1, MIR6859-2, MIR6859-2, MIR6859-3, MIR6859-3, MIR6859-4, MIR6859-4, OR4F16, OR4F16, OR4F29, OR4F29, OR4F3, OR4F3, OR4F5, WASH7P"
1,2541539,3301297,759.758,del,"ACTRT2, LOC100996583, MIR4251, MMEL1, PRDM16, PRDM16, PRDM16-DT, PRDM16-DT, PRXL2B, PRXL2B, PRXL2B, PRXL2B, PRXL2B, PRXL2B, PRXL2B, PRXL2B, TNFRSF14, TNFRSF14, TNFRSF14-AS1, TTC34"
1,3809806,5921915,2112.109,del,"AJAP1, AJAP1, C1orf174, CEP104, DFFB, DFFB, DFFB, DFFB, DFFB, DFFB, DFFB, DFFB, LINC01134, LINC01345, LINC01346, LINC01646, LINC01777, MIR4689, NPHP4, NPHP4, NPHP4, NPHP4"
1,6741735,7720712,978.977,del,"CAMTA1, CAMTA1, CAMTA1, CAMTA1, CAMTA1, CAMTA1, CAMTA1, CAMTA1, CAMTA1, CAMTA1, CAMTA1, CAMTA1, CAMTA1, CAMTA1, CAMTA1, CAMTA1, CAMTA1, CAMTA1, CAMTA1, CAMTA1, CAMTA1, CAMTA1, CAMTA1, CAMTA1, CAMTA1, CAMTA1, CAMTA1-AS2, CAMTA1-AS2, CAMTA1-AS2, CAMTA1-DT"
1,12955943,14057042,1101.099,del,"HNRNPCL2, HNRNPCL3, HNRNPCL3, HNRNPCL4, HNRNPCL4, LRRC38, PDPN, PDPN, PDPN, PDPN, PDPN, PRAMEF13, PRAMEF14, PRAMEF15, PRAMEF17, PRAMEF18, PRAMEF19, PRAMEF20, PRAMEF22, PRAMEF25, PRAMEF25, PRAMEF26, PRAMEF26, PRAMEF27, PRAMEF27, PRAMEF33, PRAMEF34P, PRAMEF34P, PRAMEF36P, PRAMEF36P, PRAMEF5, PRAMEF8, PRAMEF9, PRDM2, PRDM2, PRDM2, PRDM2"
1,14114100,15750734,1636.634,del,"AGMAT, C1orf195, C1orf195, CASP9, CASP9, CASP9, CASP9, CASP9, CELA2A, CELA2B, CTRC, DDI2, DNAJC16, DNAJC16, DNAJC16, EFHD2, FHAD1, FHAD1-AS1, FHAD1-AS1, KAZN, KAZN, KAZN, KAZN, KAZN, KAZN, KAZN, KAZN, KAZN-AS1, PLEKHM2, RSC1A1, SCARNA21B, SLC25A34, SLC25A34-AS1, TMEM51, TMEM51, TMEM51, TMEM51, TMEM51, TMEM51, TMEM51-AS1, TMEM82"
1,18024006,19165145,1141.139,del,"ALDH4A1, ALDH4A1, ALDH4A1, ALDH4A1, IFFO2, IGSF21, KLHDC7A, LINC01654, MIR1290, MIR4695, PAX7, PAX7, PAX7, TAS1R2, UBR4"
1,29652623,31186154,1533.531,del,"LAPTM5, LINC01648, LINC01778, MATN1, MATN1-AS1, MIR4420, NKAIN1, PUM1, PUM1, SDC3, SNORD103A, SNORD103A, SNORD103B, SNORD103B, SNORD103C"
1,34331297,35221185,889.888,del,"DLGAP3, GJA4, GJB3, GJB3, GJB4, GJB5, LOC653160, MIR552, SFPQ, SFPQ, SFPQ, SMIM12, SMIM12, SMIM12, SMIM12, TMEM35B, ZMYM1, ZMYM1, ZMYM1, ZMYM1, ZMYM1, ZMYM1, ZMYM6"
1,36945909,37940902,994.993,del,"C1orf109, C1orf109, C1orf109, C1orf109, C1orf109, C1orf109, C1orf109, C1orf109, C1orf109, C1orf109, C1orf109, C1orf109, C1orf109, C1orf109, C1orf109, C1orf109, C1orf109, C1orf109, C1orf109, C1orf109, C1orf122, C1orf122, CDCA8, CDCA8, DNALI1, EPHA10, EPHA10, GNL2, GNL2, GNL2, GRIK3, INPP5B, INPP5B, INPP5B, INPP5B, INPP5B, INPP5B, INPP5B, INPP5B, INPP5B, INPP5B, INPP5B, INPP5B, INPP5B, INPP5B, LINC01137, MANEAL, MANEAL, MANEAL, MEAF6, MEAF6, MEAF6, MEAF6, MEAF6, MEAF6, MIR4255, MIR5581, MIR6732, MTF1, RSPO1, RSPO1, RSPO1, RSPO1, SNIP1, YRDC, ZC3H12A, ZC3H12A, ZC3H12A"
1,38489451,39304264,814.813,del,"AKIRIN1, AKIRIN1, GJA9, GJA9-MYCBP, GJA9-MYCBP, GJA9-MYCBP, GJA9-MYCBP, GJA9-MYCBP, LOC105378663, MACF1, MYCBP, MYCBP, NDUFS5, NDUFS5, RHBDL2, RHBDL2, RRAGC, RRAGC"
1,42052010,42864821,812.811,del,"C1orf50, C1orf50, CCDC30, CCDC30, CCDC30, CCDC30, CLDN19, CLDN19, CLDN19, ERMAP, ERMAP, FOXJ3, FOXJ3, FOXJ3, FOXJ3, GUCA2A, GUCA2B, LOC339539, P3H1, P3H1, P3H1, PPCS, PPCS, PPCS, PPCS, PPCS, PPCS, PPCS, PPCS, PPIH, PPIH, RIMKLA, SVBP, TMEM269, TMEM269-DT, YBX1, YBX1, ZMYND12, ZMYND12, ZNF691, ZNF691"
1,47770723,51734682,3963.959,del,"AGBL4, AGBL4, AGBL4, AGBL4, AGBL4, AGBL4-AS1, AGBL4-IT1, BEND5, BEND5, BEND5, BEND5, BEND5, BEND5, C1orf185, CALR4P, CDKN2C, CDKN2C, DMRTA2, ELAVL4, ELAVL4, ELAVL4, ELAVL4, ELAVL4, ELAVL4, ELAVL4, ELAVL4, ELAVL4, ELAVL4, ELAVL4, ELAVL4, ELAVL4, ELAVL4, ELAVL4, EPS15, EPS15, FAF1, LINC01562, MIR4421, MIR6500, OSBPL9, OSBPL9, OSBPL9, OSBPL9, OSBPL9, OSBPL9, OSBPL9, OSBPL9, OSBPL9, OSBPL9, OSBPL9, OSBPL9, RNF11, SKINT1L, SLC5A9, SLC5A9, SPATA6, SPATA6, SPATA6, TRABD2B, TTC39A, TTC39A, TTC39A, TTC39A, TTC39A, TTC39A, TTC39A, TTC39A, TTC39A-AS1"
1,55625570,57156098,1530.528,del,"C8A, C8B, C8B, C8B, DAB1, DAB1, DAB1, DAB1, DAB1, DAB1, DAB1, DAB1, DAB1, DAB1, DAB1, FYB2, LINC01753, LINC01755, LINC01767, LOC101929935, PLPP3, PRKAA2"
1,57538481,60287226,2748.745,del,"C1orf87, CYP2J2, CYP2J2, CYP2J2, DAB1, DAB1, DAB1, DAB1, DAB1-AS1, DAB1-AS1, DAB1-AS1, DAB1-AS1, FGGY, FGGY, FGGY, FGGY, FGGY, FGGY, FGGY, FGGY, FGGY, FGGY, FGGY, FGGY, FGGY, FGGY, FGGY, HOOK1, HSD52, JUN, LINC01135, LINC01135, LINC01135, LINC01358, LOC101926944, MIR4711, MYSM1, OMA1, TACSTD2"
1,60521461,62228165,1706.704,del,"L1TD1, L1TD1, LINC01748, LOC101926964, MGC34796, MIR12132, MIR3116-1, MIR3116-2, NFIA, NFIA, NFIA, NFIA, NFIA-AS1, NFIA-AS2, NFIA-AS2, PATJ, PATJ, TM2D1, TM2D1, TM2D1, TM2D1"
1,63129066,63861797,732.731,del,"ALG6, DLEU2L, EFCAB7, FOXD3, FOXD3-AS1, FOXD3-AS1, FOXD3-AS1, FOXD3-AS1, ITGB3BP, ITGB3BP, ITGB3BP, ITGB3BP, ITGB3BP, ITGB3BP, LINC00466, MIR6068, PGM1, PGM1, PGM1, ROR1, ROR1"
1,64126062,65094028,967.966,del,"CACHD1, CACHD1, JAK1, JAK1, JAK1, JAK1, JAK1, JAK1, JAK1, JAK1, LINC01359, MIR101-1, MIR3671, MIR4794, RAVER2, RAVER2, ROR1, ROR1, UBE2U, UBE2U, UBE2U, UBE2U, UBE2U, UBE2U, UBE2U"
1,65352287,65829763,477.476,del,"DNAJC6, DNAJC6, DNAJC6, LEPR, LEPR, LEPR, LEPR, LEPR, LEPR, LEPROT, LEPROT, LEPROT, PDE4B, PDE4B, PDE4B"
1,66103037,67091023,987.986,del,"DNAI4, DNAI4, INSL5, MIER1, MIER1, MIER1, MIER1, MIER1, MIER1, MIER1, MIER1, MIER1, MIER1, MIER1, MIER1, MIR3117, PDE4B, PDE4B, PDE4B, PDE4B, PDE4B, PDE4B, PDE4B, SGIP1, SGIP1, SGIP1, SGIP1, SGIP1, SGIP1, SGIP1, SGIP1, SGIP1, SGIP1, SGIP1, SGIP1, SGIP1, SGIP1, SGIP1, SGIP1, SGIP1, SGIP1, SGIP1, SGIP1, SGIP1, SGIP1, SGIP1, SGIP1, SGIP1, SGIP1, SGIP1, SLC35D1, TCTEX1D1"
1,67896829,70477406,2580.577,del,"ANKRD13C, CTH, CTH, CTH, DEPDC1, DEPDC1, DEPDC1-AS1, DIRAS3, GNG12-AS1, HHLA3, HHLA3, HHLA3, HHLA3, HHLA3, HHLA3, HHLA3, HHLA3, LINC01707, LINC01758, LRRC40, LRRC7, LRRC7, LRRC7, LRRC7, LRRC7, LRRC7, LRRC7, LRRC7, LRRC7, LRRC7, MIR1262, PIN1P1, RPE65, SRSF11, SRSF11, SRSF11, SRSF11, SRSF11, SRSF11, SRSF11, SRSF11, SRSF11, SRSF11, SRSF11, SRSF11, SRSF11, SRSF11, SRSF11, WLS, WLS, WLS"
1,70905835,75035960,4130.125,del,"CRYZ, CRYZ, CRYZ, CRYZ, ERICH3, ERICH3-AS1, ERICH3-AS1, FPGT, FPGT, FPGT, FPGT-TNNI3K, FPGT-TNNI3K, LINC01360, LINC01360, LINC02238, LRRC53, LRRC53, LRRIQ3, LRRIQ3, MIR186, NEGR1, NEGR1-IT1, PTGER3, PTGER3, PTGER3, PTGER3, PTGER3, PTGER3, PTGER3, PTGER3, PTGER3, PTGER3, TNNI3K, TYW3, TYW3, TYW3, ZRANB2, ZRANB2, ZRANB2-AS1, ZRANB2-AS2"
1,75230155,76193116,962.961,del,"ACADM, ACADM, ACADM, ACADM, ACADM, ASB17, ASB17, DLSTP1, LOC101927342, MSH4, RABGGTB, RABGGTB, SLC44A5, SLC44A5, SLC44A5, SLC44A5, SLC44A5, SNORD45A, SNORD45B, SNORD45C, ST6GALNAC3, ST6GALNAC3, ST6GALNAC3, ST6GALNAC3, ST6GALNAC3, ST6GALNAC3, ST6GALNAC3, ST6GALNAC3, ST6GALNAC3, ST6GALNAC3"
1,76398322,78030952,1632.63,del,"AK5, AK5, DNAJB4, DNAJB4, DNAJB4, DNAJB4, DNAJB4, DNAJB4, FUBP1, FUBP1, FUBP1, FUBP1, FUBP1, FUBP1, FUBP1, FUBP1, LINC02567, MIGA1, MIGA1, MIGA1, MIGA1, MIGA1, MIR7156, NEXN, NEXN, NEXN-AS1, PIGK, ST6GALNAC3, ST6GALNAC3, ST6GALNAC3, ST6GALNAC3, ST6GALNAC3, ST6GALNAC3, ST6GALNAC3, ST6GALNAC3, ST6GALNAC3, ST6GALNAC3, ST6GALNAC5, ST6GALNAC5, ST6GALNAC5, USP33, USP33, USP33, USP33, USP33, USP33, USP33, USP33, USP33, USP33, USP33, USP33, USP33, ZZZ3, ZZZ3, ZZZ3, ZZZ3, ZZZ3, ZZZ3, ZZZ3, ZZZ3, ZZZ3, ZZZ3, ZZZ3, ZZZ3, ZZZ3, ZZZ3"
1,78578500,82402319,3823.819,del,"ADGRL2, ADGRL2, ADGRL2, ADGRL2, ADGRL2, ADGRL2, ADGRL2, ADGRL2, ADGRL2, ADGRL2, ADGRL2, ADGRL2, ADGRL2, ADGRL2, ADGRL2, ADGRL4, IFI44, IFI44, IFI44, IFI44L, IFI44L, IFI44L, IFI44L, IFI44L, IFI44L, LINC01781, LINC01781, LINC01781, LOC101927434"
1,82457375,84944859,2487.484,del,"CTBS, DNASE2B, DNASE2B, GNG5, LINC01361, LINC01361, LINC01362, LINC01461, LINC01555, LINC01712, LINC01725, LOC101927560, LPAR3, MCOLN2, MCOLN2, PRKACB, PRKACB, PRKACB, PRKACB, PRKACB, PRKACB, PRKACB, PRKACB, PRKACB, PRKACB, PRKACB, PRKACB, PRKACB, PRKACB, PRKACB, PRKACB, PRKACB, PRKACB, PRKACB, PRKACB, PRKACB, PRKACB, PRKACB, PRKACB, PRKACB, PRKACB, PRKACB, PRKACB, PRKACB, PRKACB, RPF1, SAMD13, SAMD13, SAMD13, SPATA1, SSX2IP, SSX2IP, SSX2IP, SSX2IP, SSX2IP, TTLL7, TTLL7, TTLL7, UOX"
1,87109022,89225135,2116.113,del,"GBP1, GBP2, GBP3, GBP3, GBP3, GBP3, GBP3, GBP4, GBP7, GTF2B, HS2ST1, KYAT3, KYAT3, KYAT3, KYAT3, KYAT3, KYAT3, KYAT3, KYAT3, KYAT3, LINC01140, LINC01140, LINC01140, LINC01140, LINC01140, LINC01364, LINC02801, LMO4, LMO4, PKN2, PKN2, PKN2, PKN2, PKN2-AS1, RBMXL1, RBMXL1"
1,90493403,91358266,864.863,del,"BARHL2, HFM1, HFM1, LINC01763, LINC02609, LINC02609, LINC02609, LINC02609, SNORD3G, ZNF644, ZNF644, ZNF644"
1,91407316,91778686,371.37,del,"CDC7, CDC7, CDC7, TGFBR3, TGFBR3, TGFBR3, TGFBR3"
1,94697603,100132031,5434.428,del,"AGL, AGL, AGL, AGL, AGL, ALG14, ALG14, ALG14, ALG14-AS1, CNN3, CNN3, CNN3, CNN3-DT, CNN3-DT, CNN3-DT, DPYD, DPYD, DPYD-AS1, DPYD-AS2, FRRS1, FRRS1, LINC01650, LINC01708, LINC01760, LINC01761, LINC01776, LINC01787, LINC01930, LINC02607, LINC02607, LINC02790, LOC100129620, LOC101928118, LOC101928118, MFSD14A, MIR137, MIR137HG, MIR2682, MIR378G, MIR548N, PALMD, PLPPR4, PLPPR4, PLPPR5, PLPPR5, PTBP2, PTBP2, PTBP2, PTBP2, PTBP2, PTBP2, PTBP2, PTBP2, PTBP2, RWDD3, RWDD3, RWDD3, RWDD3, RWDD3, RWDD3, RWDD3, SASS6, SASS6, SLC35A3, SLC35A3, SLC35A3, SLC44A3, SLC44A3, SLC44A3, SLC44A3, SLC44A3, SLC44A3, SLC44A3, SLC44A3, SLC44A3, SLC44A3-AS1, SLC44A3-AS1, SLC44A3-AS1, SLC44A3-AS1, SLC44A3-AS1, SLC44A3-AS1, SLC44A3-AS1, SNX7, SNX7, SNX7, SNX7, TLCD4, TLCD4, TLCD4-RWDD3"
1,101491390,103343239,1851.849,del,"COL11A1, COL11A1, COL11A1, COL11A1, COL11A1, DNAJA1P5, OLFM3, OLFM3, OLFM3, OLFM3, OLFM3, OLFM3"
1,103492389,104112007,619.618,del,"ACTG1P4, AMY1A, AMY1A, AMY1A, AMY1A, AMY1A, AMY1A, AMY1B, AMY1B, AMY1B, AMY1C, AMY1C, AMY1C, AMY1C, AMY1C, AMY1C, AMY2A, AMY2B, LOC100129138, LOC101928436, LOC101928436, LOC101928436, RNPC3"
1,104123019,109143033,5020.014,del,"AKNAD1, AKNAD1, C1orf194, C1orf194, C1orf194, C1orf194, C1orf194, C1orf194, C1orf194, CLCC1, CLCC1, CLCC1, CLCC1, CLCC1, CLCC1, CLCC1, CLCC1, CLCC1, CLCC1, CLCC1, CLCC1, CLCC1, CLCC1, CLCC1, CLCC1, CLCC1, CLCC1, ELAPOR1, ELAPOR1, ELAPOR1, FAM102B, FNDC7, GPSM2, GPSM2, GPSM2, HENMT1, HENMT1, LINC01661, LINC01676, LINC01676, LINC01677, MIR7852, NBPF4, NBPF6, NBPF6, NTNG1, NTNG1, NTNG1, NTNG1, NTNG1, NTNG1, NTNG1, NTNG1, NTNG1, NTNG1, NTNG1, PRMT6, PRPF38B, PRPF38B, PRPF38B, PRPF38B, PRPF38B, PRPF38B, PRPF38B, PRPF38B, PRPF38B, PRPF38B, PRPF38B, PRPF38B, PRPF38B, PRPF38B, PRPF38B, SCARNA2, SLC25A24, SLC25A24, SPATA42, SPATA42, STXBP3, TAF13, TMEM167B, TMEM167B, TMEM167B, TMEM167B, VAV3, VAV3, VAV3-AS1, WDR47, WDR47, WDR47"
1,112330218,112990877,660.659,del,"AKR7A2P1, CAPZA1, CTTNBP2NL, LINC01356, MIR11399, MIR4256, MOV10, MOV10, MOV10, MOV10, MOV10, PPM1J, RHOC, RHOC, RHOC, SLC16A1, SLC16A1, SLC16A1-AS1, SLC16A1-AS1, ST7L, ST7L, ST7L, ST7L, ST7L, TAFA3, TAFA3, TAFA3, WNT2B, WNT2B, WNT2B"
1,113667554,114123008,455.454,del,"AP4B1, AP4B1, AP4B1, AP4B1, AP4B1-AS1, AP4B1-AS1, BCL2L15, DCLRE1B, DCLRE1B, DCLRE1B, DCLRE1B, DCLRE1B, HIPK1, HIPK1, HIPK1, HIPK1, HIPK1, HIPK1, HIPK1-AS1, HIPK1-AS1, MAGI3, MAGI3, OLFML3, OLFML3, OLFML3, PHTF1, PHTF1, PHTF1, PHTF1, PHTF1, PHTF1, PHTF1, PHTF1, PHTF1, PHTF1, PHTF1, PHTF1, PHTF1, PHTF1, PHTF1, PHTF1, PHTF1, PHTF1, PHTF1, PTPN22, PTPN22, PTPN22, PTPN22, RSBN1, RSBN1, SYT6, SYT6, SYT6, SYT6, SYT6, SYT6, SYT6"
1,115603488,116925808,1322.32,del,"ATP1A1, ATP1A1, ATP1A1, ATP1A1-AS1, ATP1A1-AS1, ATP1A1-AS1, ATP1A1-AS1, ATP1A1-AS1, CASQ2, CD2, CD2, CD58, CD58, CD58, IGSF3, IGSF3, LINC01649, LINC01762, LINC01762, LINC02868, LOC101928977, MAB21L3, MIR320B1, MIR548AC, NHLH2, NHLH2, PTGFRN, SLC22A15, VANGL1, VANGL1, VANGL1"
1,117715598,118412293,696.695,del,"GDAP2, GDAP2, SPAG17, WDR3"
1,118658540,119922802,1264.262,del,"ADAM30, HAO2, HAO2, HAO2, HAO2-IT1, HMGCS2, HMGCS2, HSD3B1, HSD3B1, HSD3B2, HSD3B2, HSD3BP4, LINC00622, LINC01780, LOC105378933, LOC105378933, NBPF7, NOTCH2, PHGDH, REG4, REG4, REG4, TBX15, TBX15, WARS2, WARS2, WARS2, WARS2, WARS2, WARS2, WARS2, WARS2, WARS2-AS1, WARS2-AS1, WARS2-AS1, WARS2-AS1, WARS2-IT1, ZNF697"
1,120548428,144614469,24066.041,del,"DRD5P2, EMBP1, FAM72B, FAM72B, FAM72C, FAM72C, FAM72C, FAM72C, FAM72C, FAM72C, FCGR1B, FCGR1B, FCGR1B, FCGR1B, FCGR1CP, H2BP1, H2BP1, H2BP1, H2BP2, H2BP2, H2BP2, H3-2, H3-2, H3P4, H3P4, H3P4, LINC00623, LINC00623, LINC00623, LINC00623, LINC02591, LOC100996318, LOC100996720, LOC101060524, LOC101927429, LOC105369140, LOC105369140, LOC105369140, LOC105369140, LOC105369199, LOC105369199, LOC105369199, LOC105371215, LOC107985524, LOC644634, LSP1P5, LSP1P5, LSP1P5, LSP1P5, LSP1P5, LSP1P5, NBPF15, NBPF15, NBPF15, NBPF15, NBPF15, NBPF15, NBPF15, NBPF15, NBPF15, NBPF15, NBPF15, NBPF15, NBPF15, NBPF15, NBPF15, NBPF15, NBPF15, NBPF15, NBPF15, NBPF15, NBPF15, NBPF15, NBPF15, NBPF15, NBPF15, NBPF15, NBPF15, NBPF15, NBPF15, NBPF15, NBPF15, NBPF15, NBPF15, NBPF15, NBPF15, NBPF15, NBPF15, NBPF15, NBPF15, NBPF15, NBPF15, NBPF15, NBPF15, NBPF15, NBPF15, NBPF15, NBPF15, NBPF15, NBPF15, NBPF15, NBPF15, NBPF15, NBPF15, NBPF15, NBPF26, NOTCH2NLR, PDE4DIPP2, PDE4DIPP2, PDE4DIPP4, PPIAL4A, PPIAL4D, PPIAL4D, PPIAL4E, PPIAL4E, PPIAL4F, PPIAL4F, RNU1-1, RNU1-2, RNU1-3, RNU1-4, RNVU1-15, RNVU1-17, RNVU1-18, RNVU1-19, RNVU1-20, RNVU1-2A, RNVU1-4, SRGAP2-AS1, SRGAP2C, SRGAP2C, SRGAP2D"
1,145772627,146493346,720.719,del,"ANKRD34A, ANKRD35, ANKRD35, GNRHR2, GNRHR2, GNRHR2, HJV, HJV, HJV, HJV, HJV, HJV, HYDIN2, ITGA10, ITGA10, ITGA10, LINC01719, LINC01719, LIX1L, LIX1L-AS1, MIR6736, NBPF10, NBPF10, NOTCH2NLA, NOTCH2NLA, NUDT17, NUDT4B, NUDT4P2, PEX11B, PEX11B, PEX11B, PEX11B, PEX11B, PIAS3, POLR3C, POLR3C, POLR3GL, POLR3GL, PPIAL4H, RBM8A, RNF115, RNU1-1, RNU1-2, RNU1-3, RNU1-4, RNVU1-18, RNVU1-6, TXNIP, TXNIP"
1,146767621,147082935,315.314,del,"HYDIN2, LOC728989, NBPF12"
1,147131985,148872723,1740.738,del,"ACP6, ACP6, ACP6, ACP6, ACP6, ACP6, BCL9, CHD1L, CHD1L, CHD1L, CHD1L, CHD1L, CHD1L, CHD1L, CHD1L, CHD1L, CHD1L, CHD1L, CHD1L, CHD1L, CHD1L, CHD1L, CHD1L, CHD1L, CHD1L, CHD1L, CHD1L, CHD1L, CHD1L, CHD1L, CHD1L, CHD1L, CHD1L, CHD1L, CHD1L, CHD1L, CHD1L, CHD1L, CHD1L, CHD1L, CHD1L, CHD1L, CHD1L, CHD1L, FMO5, FMO5, FMO5, GJA5, GJA5, GJA8, GPR89B, GPR89B, GPR89B, GPR89B, GPR89B, GPR89B, LINC00624, LINC01138, LINC01138, LINC02805, LOC101927468, MIR5087, MIR6077, NBPF11, NBPF11, NBPF11, NBPF11, NBPF11, NBPF11, NBPF11, NBPF11, NBPF11, NBPF11, NBPF11, NBPF11, NBPF11, NBPF11, NBPF11, NBPF11, NBPF11, NBPF11, NBPF11, NBPF14, NOTCH2NLB, NOTCH2NLB, NUDT4B, NUDT4P2, PDE4DIP, PDE4DIP, PDE4DIP, PDE4DIP, PDE4DIP, PDE4DIP, PDE4DIP, PDE4DIPP1, PDE4DIPP6, PDE4DIPP6, PDE4DIPP6, PDE4DIPP6, PDE4DIPP6, PDE4DIPP6, PDE4DIPP6, PDE4DIPP6, PDE4DIPP6, PDE4DIPP6, PDIA3P1, PDZK1P1, PPIAL4G, PRKAB2, PRKAB2, PRKAB2, RNVU1-1, RNVU1-3, RNVU1-7, SEC22B2P, SEC22B3P"
1,149106958,149857707,750.749,del,"FCGR1A, FCGR1A, FCGR1A, FCGR1A, FCGR1A, FCGR1A, FCGR1A, FCGR1A, FCGR1A, FCGR1A, FCGR1A, FCGR1A, H2AC18, H2AC18, H2AC19, H2AC19, H2BC18, H2BC18, H2BC20P, H3C13, H3C14, H3C14, H3C15, H3C15, H4C14, H4C15, H4C15, H4C15, H4C15, H4C15, LINC00869, LINC00869, LINC00869, LINC00869, LINC02591, LOC644634, LOC653513, NBPF19, NOTCH2NLC, NOTCH2NLC, PPIAL4C, SEC22B2P, SEC22B3P"
1,162829667,166809642,3979.975,del,"ALDH9A1, ALDH9A1, CCDC190, FAM78B, FAM78B, FAM78B, FAM78B, FMO9P, LINC01675, LMX1A, LMX1A, LOC100422212, LOC440700, LRRC52, LRRC52-AS1, MGST3, MIR3658, MIR921, NUF2, NUF2, PBX1, PBX1, PBX1, PBX1, PBX1, PBX1-AS1, RGS4, RGS4, RGS4, RGS4, RGS5, RGS5, RGS5, RGS5, RGS5, RGS5-AS1, RXRG, RXRG, RXRG, RXRG, TMCO1, TMCO1, TMCO1, TMCO1, TMCO1-AS1, UCK2, UCK2"
1,168283115,169256086,972.971,del,"ATP1B1, DPT, LINC00626, LINC00970, LOC100505918, LOC101928565, LOC101928596, MIR557, NME7, NME7, NME7, TBX19, XCL1, XCL2"
1,170024855,170913742,888.887,del,"GORAB, GORAB, GORAB, GORAB, GORAB-AS1, KIFAP3, KIFAP3, KIFAP3, KIFAP3, KIFAP3, KIFAP3, LINC01142, LINC01681, METTL11B, MIR3119-1, MIR3119-2, PRRX1, PRRX1"
1,171766595,172410237,643.642,del,"DNM3, DNM3, DNM3, DNM3, DNM3, DNM3, DNM3, DNM3-IT1, DNM3OS, DNM3OS, EEF1AKNMT, EEF1AKNMT, EEF1AKNMT, MIR199A2, MIR214, MIR3120"
1,172635463,173450276,814.813,del,"FASLG, FASLG, LOC100506023, PRDX6-AS1, TNFSF18, TNFSF4, TNFSF4"
1,173962789,174972797,1010.008,del,"GPR52, RABGAP1L, RABGAP1L, RABGAP1L, RABGAP1L, RABGAP1L, RABGAP1L, RABGAP1L, RABGAP1L, RABGAP1L, RABGAP1L, RABGAP1L, RABGAP1L, RABGAP1L, RABGAP1L, RABGAP1L, RABGAP1L, RABGAP1L, RABGAP1L, RABGAP1L, RABGAP1L, RABGAP1L, RABGAP1L-AS1, RABGAP1L-DT, RC3H1, RC3H1, RC3H1, RC3H1"
1,175376201,176524347,1148.146,del,"COP1, COP1, COP1, LINC01657, MIR1843, PAPPA2, PAPPA2, SCARNA3, TNR, TNR"
1,177030854,178408229,1377.375,del,"ASTN1, ASTN1, ASTN1, ASTN1, BRINP2, CRYZL2P, CRYZL2P, CRYZL2P, CRYZL2P, CRYZL2P, CRYZL2P, CRYZL2P, CRYZL2P, CRYZL2P-SEC16B, CRYZL2P-SEC16B, CRYZL2P-SEC16B, LINC01645, LINC01741, RASAL2, RASAL2, RASAL2-AS1, SEC16B, SEC16B, SEC16B"
1,180244064,180756575,512.511,del,"ACBD6, LHX4, LHX4-AS1, MIR3121, OVAAL, XPR1, XPR1, XPR1, XPR1"
1,181024844,181679497,654.653,del,"CACNA1E, CACNA1E, CACNA1E, IER5, LINC01699, LINC01732, MR1, MR1, MR1, MR1, MR1, MR1, MR1, MR1, MR1"
1,181768587,182353170,584.583,del,"CACNA1E, CACNA1E, CACNA1E, LINC01344, ZNF648"
1,183947764,184662477,714.713,del,"C1orf21, COLGALT2, COLGALT2, COLGALT2, TSEN15, TSEN15, TSEN15, TSEN15, TSEN15, TSEN15, TSEN15"
1,185279094,185877691,598.597,del,"GS1-279B7.1, HMCN1, IVNS1ABP, LINC01350, SWT1, SWT1"
1,186419233,196641444,10222.211,del,"B3GALT2, BRINP3, BRINP3, CDC73, GLRX2, GLRX2, GLRX2, KCNT2, KCNT2, KCNT2, KCNT2, KCNT2, LINC01031, LINC01036, LINC01037, LINC01351, LINC01351, LINC01680, LINC01720, LINC01724, MIR1278, MIR4426, MIR4735, ODR4, ODR4, ODR4, PACERR, PDC, PDC, PDC-AS1, PLA2G4A, PLA2G4A, PTGS2, RGS1, RGS13, RGS13, RGS18, RGS2, RGS2-AS1, RGS21, RO60, RO60, RO60, RO60, RO60, RO60, SCARNA18B, UCHL5, UCHL5, UCHL5, UCHL5, UCHL5, UCHL5, UCHL5, UCHL5, UCHL5, UCHL5, UCHL5, UCHL5, UCHL5, UCHL5, UCHL5, UCHL5, UCHL5, UCHL5, UCHL5, UCHL5"
1,197412215,198665466,1253.251,del,"ATP6V1G3, ATP6V1G3, ATP6V1G3, ATP6V1G3, ATP6V1G3, ATP6V1G3, C1orf53, CRB1, CRB1, CRB1, CRB1, CRB1, CRB1, DENND1B, DENND1B, DENND1B, DENND1B, DENND1B, LHX9, LHX9, LHX9, NEK7, PTPRC, PTPRC, PTPRC, PTPRC"
1,198725527,200375174,1649.647,del,"LINC00862, LINC01221, LINC01222, LINC02789, MIR181A1, MIR181A1HG, MIR181B1, NR5A2, NR5A2, NR5A2, PTPRC, PTPRC"
1,208392184,209767557,1375.373,del,"CAMK1G, G0S2, HSD11B1, HSD11B1, HSD11B1, HSD11B1-AS1, HSD11B1-AS1, HSD11B1-AS1, LAMB3, LAMB3, LAMB3, LINC01696, LINC01698, LINC01717, LINC01774, MIR205, MIR205HG, MIR205HG, MIR205HG, MIR205HG, MIR205HG, MIR4260, TRAF3IP3, TRAF3IP3, TRAF3IP3, TRAF3IP3"
1,210025816,211444232,1418.416,del,"HHAT, HHAT, HHAT, HHAT, HHAT, HHAT, KCNH1, KCNH1, KCNH1-IT1, LINC00467, RCOR3, RCOR3, RCOR3, RCOR3, RCOR3, RCOR3, RCOR3, RCOR3, RCOR3, SERTAD4, SERTAD4, SERTAD4, SERTAD4-AS1, SYT14, SYT14, SYT14, SYT14, SYT14, SYT14, TRAF5, TRAF5, TRAF5, TRAF5"
1,213437224,214478263,1041.039,del,"LINC00538, PROX1, PROX1, PROX1-AS1, PTPN14, SMYD2"
1,214837623,215746530,908.907,del,"KCNK2, KCNK2, KCNK2, KCTD3, KCTD3, KCTD3, USH2A"
1,216501285,220087867,3586.582,del,"BPNT1, BPNT1, BPNT1, BPNT1, EPRS1, ESRRG, ESRRG, ESRRG, ESRRG, ESRRG, ESRRG, ESRRG, ESRRG, ESRRG, ESRRG, ESRRG, ESRRG, ESRRG, ESRRG, ESRRG, ESRRG, ESRRG, ESRRG, ESRRG, ESRRG, GPATCH2, GPATCH2, LINC00210, LINC01653, LINC01710, LINC02869, LYPLAL1, LYPLAL1, LYPLAL1, LYPLAL1, LYPLAL1, LYPLAL1, LYPLAL1, LYPLAL1-AS1, LYPLAL1-DT, MIR548F3, RRP15, SLC30A10, SLC30A10, SLC30A10, SLC30A10, SPATA17, SPATA17, SPATA17-AS1, TGFB2, TGFB2, TGFB2, TGFB2, TGFB2-AS1, TGFB2-OT1, ZC3H11B"
1,220491271,222695472,2204.201,del,"AIDA, C1orf115, DUSP10, DUSP10, DUSP10, HHIPL2, HLX, HLX-AS1, LINC01352, LINC01655, LINC02257, LINC02474, LINC02817, MARK1, MARK1, MARK1, MARK1, MARK1, MIA3, MIA3, MIA3, MIA3, MIA3, MIA3, MTARC1, MTARC2, MTARC2, MTARC2, RNU6ATAC35P, TAF1A, TAF1A, TAF1A, TAF1A-AS1, TAF1A-AS1"
1,223287064,223930706,643.642,del,"CAPN2, CAPN2, CAPN8, CCDC185, SUSD4, SUSD4, TP53BP2, TP53BP2"
1,224052829,224340115,287.286,del,"DEGS1, DEGS1, DEGS1, FBXO28, FBXO28, FBXO28, LOC101927143, LOC101927164, MIR320B2, NVL, NVL, NVL, NVL"
1,224620396,226015789,1395.393,del,"CNIH3, CNIH3, CNIH3, CNIH3, CNIH3, CNIH3, CNIH3, CNIH3, CNIH3, CNIH3, CNIH3, CNIH3, CNIH3, CNIH3, CNIH3, CNIH3, DNAH14, DNAH14, DNAH14, DNAH14, DNAH14, DNAH14, ENAH, ENAH, ENAH, ENAH, ENAH, EPHX1, EPHX1, EPHX1, EPHX1, EPHX1, EPHX1, EPHX1, EPHX1, EPHX1, EPHX1, EPHX1, EPHX1, EPHX1, EPHX1, LBR, LBR, LEFTY1, LEFTY2, LEFTY2, MIR6741, PYCR2, PYCR2, SDE2, SRP9, SRP9, TMEM63A"
1,227336109,228284055,947.946,del,"ARF1, ARF1, ARF1, ARF1, C1orf35, C1orf35, GJC2, GUK1, GUK1, GUK1, GUK1, GUK1, IBA57, IBA57, IBA57-DT, IBA57-DT, JMJD4, JMJD4, LINC02809, LOC105373289, LOC105373289, LOC105373289, LOC105373289, LOC105373289, LOC105373289, LOC107985355, MIR3620, MIR5008, MRPL55, MRPL55, MRPL55, MRPL55, MRPL55, MRPL55, MRPL55, MRPL55, MRPL55, OBSCN, OBSCN, OBSCN, OBSCN-AS1, OBSCN-AS1, PRSS38, PRSS38, SNAP47, SNAP47, SNAP47, SNAP47, SNAP47, SNAP47, SNAP47, SNAP47, SNAP47, SNAP47, SNAP47, WNT3A, WNT9A, ZNF678, ZNF678, ZNF678, ZNF678, ZNF678, ZNF847P"
1,228652424,229566336,913.912,del,"ABCB10, ACTA1, CCSAP, LOC101927478, LOC105373159, LOC105373159, MIR4454, NUP133, RAB4A, RAB4A, RAB4A, RHOU, RHOU"
1,229795566,230794563,998.997,del,"AGT, AGT, CAPN9, CAPN9, CAPN9, COG2, COG2, GALNT2, GALNT2, GALNT2, LINC01682, LINC01682, LINC01682, LINC01682, LINC01736, LINC01737, PGBD5"
1,231510279,232534301,1024.022,del,"DISC1, DISC1, DISC1, DISC1, DISC1, DISC1, DISC1, DISC1, DISC1, DISC1, DISC1, DISC1, DISC1, DISC1, DISC1, DISC1, DISC1, DISC1, DISC1, DISC1, DISC1, DISC1, DISC1, DISC1-IT1, DISC2, LINC00582, SIPA1L2, SIPA1L2, TSNAX, TSNAX-DISC1, TSNAX-DISC1, TSNAX-DISC1, TSNAX-DISC1, TSNAX-DISC1, TSNAX-DISC1, TSNAX-DISC1, TSNAX-DISC1"
1,232651419,234444209,1792.79,del,"COA6, COA6, COA6, COA6-AS1, COA6-AS1, KCNK1, LINC01744, LINC01745, MAP10, MAP3K21, MIR4427, MIR4671, NTPCR, NTPCR, NTPCR, NTPCR, NTPCR, NTPCR, NTPCR, NTPCR, PCNX2, PCNX2, SLC35F3, SLC35F3, TARBP1"
1,234609375,235275039,665.664,del,"ARID4B, ARID4B, ARID4B, ARID4B, IRF2BP2, IRF2BP2, LINC00184, LINC01132, LINC01348, LOC101927787, LOC101927851, MIR4753, PP2672, RBM34, RBM34, RBM34, RBM34, RBM34, RBM34, SNORA14B, TOMM20"
1,237061825,237659421,597.596,del,"MIR4428, RYR2"
1,238054817,241660418,3605.601,del,"CHML, CHML, CHML, CHRM3, CHRM3, CHRM3, CHRM3, CHRM3, CHRM3, CHRM3, CHRM3, CHRM3, CHRM3, CHRM3, CHRM3-AS1, CHRM3-AS2, FH, FMN2, FMN2, FMN2, GREM2, KMO, LINC01139, MIR3123, OPN3, OPN3, OPN3, RGS7, RGS7, RGS7, RGS7, RGS7, RGS7, RGS7, RGS7, RGS7, RGS7, RGS7, RGS7, RGS7, RGS7, RGS7, RGS7, RGS7, RGS7, RGS7, RGS7, RPS7P5, WDR64"
1,242053812,246671424,4617.612,del,"ADSS2, ADSS2, AKT3, AKT3, AKT3, AKT3, C1orf100, C1orf100, C1orf100, CATSPERE, CATSPERE, CATSPERE, CEP170, CEP170, CEP170, CNST, CNST, COX20, COX20, COX20, COX20, COX20, COX20, COX20, COX20, DESI2, DESI2, DESI2, DESI2, EFCAB2, EFCAB2, EFCAB2, EFCAB2, HNRNPU, HNRNPU, KIF26B, KIF26B-AS1, LINC01347, LINC01743, LINC02774, LOC101928068, MIR4677, PLD5, PLD5, PLD5, PLD5, SDCCAG8, SDCCAG8, SDCCAG8, SDCCAG8, SDCCAG8, SDCCAG8, SMYD3, SMYD3, SMYD3, SMYD3, SMYD3, SMYD3, SNORA100, TFB2M, ZBTB18, ZBTB18, ZBTB18"
2,3750747,8869860,5119.113,del,"CMPK2, CMPK2, CMPK2, CMPK2, DCDC2C, DCDC2C, GRASLND, ID2, ID2-AS1, ID2-AS1, KIDINS220, KIDINS220, KIDINS220, KIDINS220, KIDINS220, KIDINS220, KIDINS220, KIDINS220, KIDINS220, KIDINS220, KIDINS220, KIDINS220, KIDINS220, KIDINS220, KIDINS220, KIDINS220, LINC00298, LINC00299, LINC00299, LINC00487, LINC01246, LINC01246, LINC01247, LINC01248, LINC01249, LINC01304, LINC01810, LINC01814, LOC100506274, LOC101929452, LOC101929551, LOC105373394, LOC400940, MBOAT2, MBOAT2, MBOAT2, MBOAT2, MBOAT2, MBOAT2, MBOAT2, MBOAT2, MBOAT2, MBOAT2, MBOAT2, MBOAT2, MBOAT2, MIR7158, MIR7515, MIR7515HG, NRIR, RNF144A, RNF144A, RNF144A, RNF144A, RNF144A, RNF144A, RNF144A, RNF144A, RSAD2, SILC1, SOX11"
2,9029020,9458448,429.428,del,"ASAP2, ASAP2, CPSF3, CPSF3, CPSF3, CPSF3, CPSF3, ITGB1BP1, ITGB1BP1, ITGB1BP1, ITGB1BP1, ITGB1BP1, ITGB1BP1, ITGB1BP1, ITGB1BP1, ITGB1BP1, ITGB1BP1, ITGB1BP1, ITGB1BP1, ITGB1BP1, ITGB1BP1, ITGB1BP1, ITGB1BP1, ITGB1BP1, ITGB1BP1, ITGB1BP1, ITGB1BP1, ITGB1BP1"
2,11965954,15415399,3449.445,del,"LINC00276, LOC100506474, LRATD1, LRATD1, LRATD1, MIR3125, MIR3681, MIR3681HG, MIR3681HG, MIR3681HG, NBAS, NBAS, TRIB2, TRIB2"
2,15771756,17691673,1919.917,del,"CYRIA, GACAT3, MYCN, MYCN, MYCN, MYCN, MYCNOS, MYCNOS, MYCNOS, MYCNUT, RAD51AP2, RAD51AP2, SMC6, SMC6, VSNL1, VSNL1, VSNL1, VSNL1, VSNL1"
2,17963946,20096075,2132.129,del,"LAPTM4A, LINC00954, LINC01376, LOC101928222, MATN3, MIR4757, NT5C1B, NT5C1B, NT5C1B, NT5C1B, NT5C1B, NT5C1B-RDH14, NT5C1B-RDH14, OSR1, RDH14, TTC32, WDR35, WDR35"
2,21266245,23976952,2710.707,del,"ATAD2B, ATAD2B, ATAD2B, ATAD2B, KLHL29, LINC01822, LINC01884, UBXN2A"
2,29551522,31457425,1905.903,del,"ALK, CAPN13, CAPN14, CAPN14, EHD3, GALNT14, GALNT14, GALNT14, GALNT14, GALNT14, GALNT14, LBH, LCLAT1, LCLAT1, LCLAT1, LCLAT1, LINC01936, SNORA10B, XDH, YPEL5, YPEL5, YPEL5, YPEL5"
2,31638607,32339306,700.699,del,"DPY30, DPY30, DPY30, DPY30, DPY30, LINC01946, MEMO1, MEMO1, MEMO1, MEMO1, MEMO1, MEMO1, MEMO1, MEMO1, MEMO1, MEMO1, MEMO1, MEMO1, MEMO1, MEMO1, MEMO1, MEMO1, MEMO1, MEMO1, MEMO1, MEMO1, NLRC4, NLRC4, NLRC4, NLRC4, SLC30A6, SLC30A6, SLC30A6, SLC30A6, SLC30A6, SLC30A6, SLC30A6, SLC30A6, SPAST, SPAST, SPAST, SPAST, SPAST, YIPF4"
2,33827794,36667630,2839.836,del,"CRIM1, CRIM1-DT, FEZ2, FEZ2, LINC01317, LINC01318, LINC01320, MIR548AD"
