chromosome,st_bp,end_bp,length_kb,cnv_type,overlapping_genes
1,149857708,162829666,12971.958,dup,"ACKR1, ACKR1, ADAM15, ADAM15, ADAM15, ADAM15, ADAM15, ADAM15, ADAM15, ADAM15, ADAM15, ADAM15, ADAM15, ADAM15, ADAMTS4, ADAMTS4, ADAMTSL4, ADAMTSL4, ADAMTSL4, ADAMTSL4, ADAMTSL4, ADAMTSL4-AS1, ADAR, ADAR, ADAR, ADAR, ADAR, ADAR, ADAR, ADAR, ADAR, ADAR, AIM2, AIM2, ANP32E, ANP32E, ANP32E, ANP32E, ANP32E, ANXA9, APCS, APH1A, APH1A, APH1A, APH1A, APH1A, APH1A, APH1A, APOA2, AQP10, ARHGAP30, ARHGAP30, ARHGAP30, ARHGAP30, ARHGEF11, ARHGEF11, ARHGEF11, ARHGEF11, ARHGEF2, ARHGEF2, ARHGEF2, ARHGEF2, ARHGEF2, ARHGEF2, ARNT, ARNT, ARNT, ARNT, ARNT, ARNT, ARNT, ARNT, ASH1L, ASH1L, ASH1L-AS1, ASH1L-AS1, ATF6, ATP1A2, ATP1A4, ATP1A4, ATP8B2, ATP8B2, ATP8B2, ATP8B2, ATP8B2, B4GALT3, B4GALT3, B4GALT3, BCAN, BCAN, BGLAP, BNIPL, BNIPL, BOLA1, BOLA1, BOLA1, C1orf189, C1orf226, C1orf226, C1orf43, C1orf43, C1orf43, C1orf43, C1orf43, C1orf43, C1orf43, C1orf43, C1orf54, C1orf54, C1orf54, C1orf54, C1orf54, C1orf56, C1orf68, C2CD4D, C2CD4D-AS1, C2CD4D-AS1, CA14, CADM3, CADM3, CADM3, CADM3-AS1, CASQ1, CCT3, CCT3, CCT3, CCT3, CD1A, CD1A, CD1B, CD1C, CD1D, CD1D, CD1D, CD1D, CD1D, CD1E, CD1E, CD1E, CD1E, CD1E, CD1E, CD1E, CD1E, CD1E, CD1E, CD1E, CD1E, CD1E, CD244, CD244, CD244, CD48, CD48, CD5L, CD5L, CD84, CD84, CD84, CD84, CD84, CDC42SE1, CDC42SE1, CELF3, CELF3, CELF3, CELF3, CELF3, CERS2, CERS2, CFAP126, CFAP45, CGN, CHRNB2, CHTOP, CHTOP, CHTOP, CHTOP, CIART, CIART, CIART, CIART, CIART, CKS1B, CKS1B, CLK2, CLK2, CLK2, CLK2, COPA, COPA, CRABP2, CRABP2, CRCT1, CREB3L4, CREB3L4, CREB3L4, CREB3L4, CREB3L4, CREB3L4, CRNN, CRP, CRP, CRP, CRP, CRTC2, CTSK, CTSS, CTSS, CTXND2, CYCSP52, DAP3, DAP3, DAP3, DAP3, DAP3, DCAF8, DCAF8, DCAF8, DCAF8, DCAF8, DCST1, DCST1, DCST1-AS1, DCST1-AS1, DCST2, DDR2, DDR2, DDR2, DDR2, DEDD, DEDD, DEDD, DEDD, DENND4B, DENND4B, DPM3, DPM3, DUSP12, DUSP23, DUSP23, DUSP23, ECM1, ECM1, ECM1, EFNA1, EFNA1, EFNA3, EFNA4, EFNA4, EFNA4, ENSA, ENSA, ENSA, ENSA, ENSA, ENSA, ENSA, ENSA, ETV3, ETV3, ETV3L, F11R, F11R, F11R, F11R, F11R, F11R, FALEC, FAM189B, FAM189B, FAM189B, FCER1A, FCER1G, FCGR2A, FCGR2A, FCGR2A, FCGR2A, FCGR2B, FCGR2B, FCGR2B, FCGR2B, FCGR2B, FCGR2C, FCGR2C, FCGR3A, FCGR3A, FCGR3A, FCGR3A, FCGR3A, FCGR3A, FCGR3A, FCGR3B, FCGR3B, FCGR3B, FCGR3B, FCGR3B, FCRL1, FCRL1, FCRL1, FCRL2, FCRL2, FCRL2, FCRL3, FCRL3, FCRL3, FCRL3, FCRL3, FCRL3, FCRL4, FCRL5, FCRL5, FCRL6, FCRL6, FCRLA, FCRLA, FCRLA, FCRLA, FCRLA, FCRLA, FCRLA, FCRLA, FCRLA, FCRLB, FCRLB, FCRLB, FCRLB, FCRLB, FCRLB, FDPS, FDPS, FDPS, FDPS, FDPS, FDPS, FDPS, FLAD1, FLAD1, FLAD1, FLAD1, FLG, FLG-AS1, FLG-AS1, FLG2, GABPB2, GABPB2, GABPB2, GABPB2, GABPB2, GABPB2, GABPB2, GABPB2, GABPB2, GATAD2B, GBA, GBA, GBA, GBA, GBA, GBAP1, GLMP, GLMP, GLMP, GLMP, GLMP, GOLPH3L, GON4L, GON4L, GON4L, GON4L, GON4L, GPATCH4, GPATCH4, H2AC20, H2AC21, H2BC21, H4C14, H4C15, H4C15, H4C15, H4C15, HAPLN2, HAX1, HAX1, HCN3, HCN3, HDGF, HDGF, HDGF, HDGF, HDGF, HDGF, HDGF, HORMAD1, HORMAD1, HRNR, HSD17B7, HSD17B7, HSD17B7, HSPA6, HSPA7, IFI16, IFI16, IFI16, IFI16, IFI16, IFI16, IFI16, IFI16, IGSF8, IGSF8, IGSF8, IGSF9, IGSF9, IL6R, IL6R, IL6R, IL6R, IL6R, IL6R, IL6R, IL6R, IL6R, IL6R-AS1, ILF2, ILF2, INSRR, INTS3, INTS3, IQGAP3, ISG20L2, ISG20L2, ISG20L2, ISG20L2, ITLN1, ITLN2, IVL, JTB, KCNJ10, KCNJ9, KCNN3, KCNN3, KCNN3, KCNN3, KCNN3, KHDC4, KIRREL1, KIRREL1, KIRREL1-IT1, KLHDC9, KLHDC9, KLHDC9, KLHDC9, KPRP, KRTCAP2, LAMTOR2, LAMTOR2, LCE1A, LCE1B, LCE1C, LCE1C, LCE1D, LCE1E, LCE1F, LCE2A, LCE2B, LCE2C, LCE2D, LCE3A, LCE3B, LCE3C, LCE3D, LCE3E, LCE4A, LCE5A, LCE6A, LELP1, LENEP, LINC00302, LINC01133, LINC01704, LINGO4, LMNA, LMNA, LMNA, LMNA, LMNA, LMNA, LMNA, LOC100131107, LOC100287049, LOC101928009, LOC101928034, LOC101928120, LOC101928177, LOC101928372, LOC105371433, LOC105371458, LOC112543491, LOC343052, LOC729867, LORICRIN, LRRC71, LY9, LY9, LY9, LY9, LYSMD1, LYSMD1, MCL1, MCL1, MCL1, MEF2D, MEF2D, MEX3A, MINDY1, MINDY1, MINDY1, MINDY1, MINDY1, MINDY1, MINDY1, MINDY1, MINDY1, MINDY1, MINDY1, MINDY1, MINDY1, MINDY1, MINDY1, MINDY1, MINDY1, MIR190B, MIR4257, MIR4258, MIR4259, MIR4654, MIR5187, MIR554, MIR555, MIR556, MIR5698, MIR6737, MIR6738, MIR6878, MIR765, MIR8083, MIR9-1, MIR9-1HG, MIR9-1HG, MIR9-1HG, MIR9-1HG, MIR9-1HG, MIR9-1HG, MIR9-1HG, MIR9-1HG, MIR9-1HG, MIR9-1HG, MIR9-1HG, MIR9-1HG, MIR9-1HG, MIR92B, MLLT11, MNDA, MPZ, MPZ, MRPL24, MRPL24, MRPL9, MRPL9, MRPL9, MRPS21, MRPS21, MSTO1, MSTO1, MSTO1, MSTO1, MSTO1, MSTO1, MSTO1, MSTO1, MSTO1, MSTO1, MSTO1, MSTO1, MSTO1, MSTO1, MSTO1, MSTO1, MSTO1, MSTO1, MSTO1, MSTO1, MSTO1, MSTO1, MSTO1, MSTO1, MSTO1, MSTO1, MSTO1, MSTO2P, MSTO2P, MTMR11, MTMR11, MTX1, MTX1, MUC1, MUC1, MUC1, MUC1, MUC1, MUC1, MUC1, MUC1, MUC1, MUC1, MUC1, MUC1, MUC1, MUC1, MUC1, MUC1, MUC1, MUC1, MUC1, MUC1, MUC1, NAXE, NBPF18P, NCSTN, NCSTN, NCSTN, NCSTN, NDUFS2, NDUFS2, NDUFS2, NDUFS2, NDUFS2, NDUFS2, NDUFS2, NDUFS2, NECTIN4, NES, NHLH1, NIT1, NIT1, NIT1, NIT1, NOS1AP, NOS1AP, NOS1AP, NPR1, NR1I3, NR1I3, NR1I3, NR1I3, NR1I3, NR1I3, NR1I3, NR1I3, NR1I3, NR1I3, NR1I3, NR1I3, NR1I3, NR1I3, NR1I3, NTRK1, NTRK1, NTRK1, NUP210L, NUP210L, OAZ3, OAZ3, OAZ3, OLFML2B, OLFML2B, OLFML2B, OR10J1, OR10J1, OR10J1, OR10J3, OR10J4, OR10J4, OR10J5, OR10K1, OR10K2, OR10R2, OR10T2, OR10X1, OR10Z1, OR6K2, OR6K3, OR6K6, OR6N1, OR6N2, OR6P1, OR6Y1, OTUD7B, PAQR6, PAQR6, PAQR6, PAQR6, PAQR6, PAQR6, PAQR6, PAQR6, PAQR6, PAQR6, PAQR6, PAQR6, PAQR6, PBXIP1, PBXIP1, PBXIP1, PCP4L1, PEA15, PEA15, PEA15, PEA15, PEA15, PEAR1, PEAR1, PEAR1, PEX19, PEX19, PEX19, PEX19, PFDN2, PGLYRP3, PGLYRP4, PI4KB, PI4KB, PI4KB, PI4KB, PI4KB, PI4KB, PI4KB, PI4KB, PI4KB, PI4KB, PI4KB, PIGM, PIP5K1A, PIP5K1A, PIP5K1A, PIP5K1A, PIP5K1A, PKLR, PKLR, PLEKHO1, PLEKHO1, PLEKHO1, PLEKHO1, PMF1, PMF1, PMF1, PMF1-BGLAP, PMF1-BGLAP, PMF1-BGLAP, PMF1-BGLAP, PMVK, PMVK, PMVK, PMVK, POGZ, POGZ, POGZ, POGZ, POGZ, POU5F1P4, PPOX, PPOX, PPOX, PPOX, PPOX, PPOX, PPOX, PPOX, PPOX, PPOX, PRCC, PRPF3, PRPF3, PRPF3, PRPF3, PRPF3, PRPF3, PRR9, PRUNE1, PRUNE1, PRUNE1, PRUNE1, PRUNE1, PRUNE1, PRUNE1, PRUNE1, PSMB4, PSMD4, PSMD4, PYDC5, PYGO2, PYHIN1, PYHIN1, PYHIN1, PYHIN1, RAB13, RAB13, RAB13, RAB25, RAB25, RFX5, RFX5, RFX5, RFX5, RFX5, RFX5, RFX5, RFX5, RFX5, RFX5, RFX5, RFX5-AS1, RHBG, RHBG, RHBG, RHBG, RHBG, RHBG, RHBG, RIIAD1, RIT1, RIT1, RIT1, RORC, RORC, RPL31P11, RPRD2, RPRD2, RPRD2, RPS27, RPS27, RPS27, RPTN, RRNAD1, RRNAD1, RUSC1, RUSC1, RUSC1, RUSC1, RUSC1, RUSC1, RUSC1, RUSC1, RUSC1, RUSC1-AS1, RUSC1-AS1, RUSC1-AS1, RXFP4, S100A1, S100A10, S100A11, S100A12, S100A13, S100A13, S100A13, S100A13, S100A13, S100A14, S100A16, S100A16, S100A16, S100A16, S100A2, S100A2, S100A2, S100A3, S100A4, S100A4, S100A5, S100A6, S100A7, S100A7A, S100A8, S100A8, S100A8, S100A8, S100A8, S100A9, SCAMP3, SCAMP3, SCARNA26A, SCARNA26B, SCARNA4, SCNM1, SCNM1, SCNM1, SDHC, SDHC, SDHC, SDHC, SDHC, SDHC, SELENBP1, SELENBP1, SELENBP1, SEMA4A, SEMA4A, SEMA4A, SEMA4A, SEMA4A, SEMA4A, SEMA4A, SEMA4A, SEMA6C, SEMA6C, SEMA6C, SETDB1, SETDB1, SETDB1, SETDB1, SETDB1, SF3B4, SH2D1B, SH2D2A, SH2D2A, SH2D2A, SH2D2A, SH2D2A, SHC1, SHC1, SHC1, SHC1, SHC1, SHE, SHE, SLAMF1, SLAMF1, SLAMF1, SLAMF1, SLAMF1, SLAMF6, SLAMF6, SLAMF6, SLAMF6, SLAMF7, SLAMF7, SLAMF7, SLAMF7, SLAMF7, SLAMF7, SLAMF7, SLAMF7, SLAMF7, SLAMF7, SLAMF8, SLAMF8, SLAMF9, SLAMF9, SLAMF9, SLC25A44, SLC25A44, SLC25A44, SLC25A44, SLC25A44, SLC25A44, SLC25A44, SLC25A44, SLC25A44, SLC25A44, SLC25A44, SLC27A3, SLC27A3, SLC27A3, SLC39A1, SLC39A1, SLC39A1, SLC39A1, SLC39A1, SLC39A1, SLC50A1, SLC50A1, SLC50A1, SLC50A1, SLC50A1, SLC50A1, SLC50A1, SLC50A1, SLC50A1, SLC50A1, SMCP, SMG5, SMG5, SMG5, SMG5, SMG5, SNAPIN, SNAPIN, SNAPIN, SNHG28, SNHG28, SNHG28, SNHG28, SNORA58B, SNORA80E, SNORD13C, SNX27, SNX27, SPATA46, SPRR1A, SPRR1A, SPRR1B, SPRR2A, SPRR2B, SPRR2C, SPRR2D, SPRR2D, SPRR2E, SPRR2F, SPRR2F, SPRR2G, SPRR3, SPRR3, SPRR4, SPTA1, SSR2, SUMO1P3, SV2A, SV2A, SV2A, SV2A, SYT11, TAGLN2, TAGLN2, TAGLN2, TARS2, TARS2, TARS2, TARS2, TARS2, TCHH, TCHHL1, TDRD10, TDRD10, TDRKH, TDRKH, TDRKH, TDRKH, TDRKH-AS1, TDRKH-AS1, THBS3, THBS3, THBS3, THBS3, THEM4, THEM5, TMEM79, TMEM79, TMOD4, TNFAIP8L2, TNFAIP8L2-SCNM1, TNFAIP8L2-SCNM1, TOMM40L, TOMM40L, TOMM40L, TPM3, TPM3, TPM3, TPM3, TPM3, TPM3, TPM3, TPM3, TPM3, TPM3, TPM3, TPM3, TPM3, TPM3, TPM3, TPM3, TPM3, TRIM46, TRIM46, TRIM46, TRIM46, TRIM46, TRIM46, TRIM46, TRIM46, TSACC, TSACC, TSACC, TSACC, TSACC, TSACC, TSACC, TSACC, TSACC, TSACC, TSACC, TSACC, TSTD1, TSTD1, TSTD1, TTC24, TUFT1, TUFT1, TUFT1, UAP1, UAP1, UAP1, UAP1, UAP1, UAP1, UBAP2L, UBAP2L, UBAP2L, UBAP2L, UBAP2L, UBAP2L, UBAP2L, UBAP2L, UBAP2L, UBAP2L, UBAP2L, UBAP2L, UBAP2L, UBAP2L, UBAP2L, UBAP2L, UBAP2L, UBAP2L, UBAP2L, UBAP2L, UBAP2L, UBAP2L, UBAP2L, UBAP2L, UBE2Q1, UBE2Q1-AS1, UBQLN4, UBQLN4, UFC1, UHMK1, UHMK1, UHMK1, USF1, USF1, USF1, USP21, USP21, USP21, USP21, VANGL2, VHLL, VPS45, VPS45, VPS45, VPS45, VPS72, VPS72, VPS72, VSIG8, YY1AP1, YY1AP1, YY1AP1, YY1AP1, YY1AP1, YY1AP1, YY1AP1, YY1AP1, YY1AP1, YY1AP1, YY1AP1, YY1AP1, ZBTB7B, ZBTB7B, ZBTB7B, ZBTB7B, ZBTB7B, ZBTB7B, ZBTB7B, ZNF687, ZNF687, ZNF687, ZNF687-AS1"
1,166809643,168283114,1473.471,dup,"ADCY10, ADCY10, ADCY10, ANKRD36BP1, CD247, CD247, CD247, CD247, CREG1, DCAF6, DCAF6, DCAF6, DCAF6, DCAF6, DCAF6, DCAF6, DCAF6, DCAF6, DCAF6, DCAF6, DCAF6, DCAF6, DCAF6, DCAF6, GPA33, GPR161, GPR161, GPR161, GPR161, GPR161, GPR161, GPR161, GPR161, GPR161, GPR161, GPR161, GPR161, GPR161, GPR161, GPR161, ILDR2, LINC01363, MAEL, MAEL, MAEL, MIR1255B2, MPC2, MPC2, MPC2, MPZL1, MPZL1, MPZL1, POGK, POGK, POU2F1, POU2F1, POU2F1, POU2F1, POU2F1, POU2F1, RCSD1, RCSD1, RCSD1, RCSD1, SFT2D2, STYXL2, TADA1, TBX19, TIPRL, TIPRL"
1,169256087,170024854,768.767,dup,"BLZF1, BLZF1, BLZF1, C1orf112, C1orf112, C1orf112, C1orf112, C1orf112, C1orf112, C1orf112, C1orf112, C1orf112, C1orf112, C1orf112, C1orf112, CCDC181, CCDC181, CCDC181, F5, KIFAP3, KIFAP3, KIFAP3, KIFAP3, KIFAP3, KIFAP3, METTL18, METTL18, METTL18, NME7, NME7, NME7, SCYL3, SCYL3, SELE, SELL, SELL, SELP, SLC19A2, SLC19A2"
1,170913743,171766594,852.851,dup,"FMO1, FMO1, FMO1, FMO1, FMO2, FMO2, FMO2, FMO2, FMO3, FMO3, FMO3, FMO3, FMO4, FMO6P, MIR1295A, MIR1295B, MROH9, MROH9, MYOC, MYOCOS, PRRC2C, TOP1P1, VAMP4, VAMP4, VAMP4"
1,172410238,172635462,225.224,dup,"C1orf105, C1orf105, DNM3, DNM3, DNM3, DNM3, DNM3, PIGC, PIGC, SUCO, SUCO, SUCO, SUCO"
1,173450277,173962788,512.511,dup,"ANKRD45, ANKRD45, CENPL, CENPL, CENPL, DARS2, DARS2, DARS2, GAS5, GAS5, GAS5, GAS5, GAS5, GAS5, GAS5, GAS5, GAS5, GAS5, GAS5, GAS5, GAS5, GAS5, GAS5, GAS5-AS1, KLHL20, LOC100506023, PRDX6, PRDX6-AS1, RC3H1, RC3H1, RC3H1, RC3H1, SERPINC1, SERPINC1, SLC9C2, SNORA103, SNORD44, SNORD47, SNORD74, SNORD75, SNORD76, SNORD77, SNORD78, SNORD79, SNORD80, SNORD81, TEX50, ZBTB37, ZBTB37, ZBTB37, ZBTB37"
1,174972798,175376200,403.402,dup,"CACYBP, CACYBP, KIAA0040, KIAA0040, KIAA0040, KIAA0040, KIAA0040, KIAA0040, MRPS14, MRPS14, RABGAP1L, RABGAP1L, RABGAP1L, RABGAP1L, RABGAP1L, RABGAP1L, RABGAP1L, RABGAP1L, RABGAP1L, RABGAP1L, RABGAP1L, RABGAP1L, TNN, TNR, TNR"
1,176524348,177030853,506.505,dup,"ASTN1, ASTN1, ASTN1, ASTN1, MIR488, PAPPA2, PAPPA2"
1,178408230,180244063,1835.833,dup,"ABL2, ABL2, ABL2, ABL2, ABL2, ABL2, ABL2, ABL2, ANGPTL1, ANGPTL1, AXDND1, AXDND1, C1orf220, CEP350, FAM163A, FAM163A, FAM163A, FAM163A, FAM163A, FAM163A, FAM163A, FAM163A, FAM163A, FAM163A, FAM163A, FAM163A, FAM163A, FAM163A, FAM20B, FAM20B, FAM20B, LHX4, MIR12116, MIR4424, NPHS2, NPHS2, QSOX1, QSOX1, RALGPS2, RALGPS2, RASAL2, RASAL2, SOAT1, SOAT1, SOAT1, SOAT1, TDRD5, TDRD5, TDRD5, TDRD5, TDRD5, TDRD5, TEX35, TEX35, TEX35, TEX35, TOR1AIP1, TOR1AIP1, TOR1AIP2, TOR1AIP2, TOR1AIP2, TOR1AIP2, TOR1AIP2, TOR1AIP2, TOR1AIP2, TOR1AIP2, TOR1AIP2, TOR3A"
1,180756576,181024843,268.267,dup,"KIAA1614, KIAA1614-AS1, STX6, STX6, XPR1, XPR1, XPR1, XPR1"
1,181679498,181768586,89.088,dup,"CACNA1E, CACNA1E, CACNA1E"
1,182353171,183947763,1594.592,dup,"APOBEC4, ARPC5, ARPC5, COLGALT2, COLGALT2, COLGALT2, DHX9, DHX9, GLUL, GLUL, GLUL, LAMC1, LAMC1-AS1, LAMC2, LAMC2, LINC00272, LINC01686, LINC01688, LOC647070, NCF2, NCF2, NCF2, NCF2, NMNAT2, NMNAT2, NPL, NPL, NPL, NPL, NPL, RGL1, RGL1, RGL1, RGL1, RGL1, RGS16, RGS8, RGS8, RGS8, RGSL1, RGSL1, RNASEL, SHCBP1L, SHCBP1L, SMG7, SMG7, SMG7, SMG7, SMG7, SMG7, SMG7, SMG7, SMG7, SMG7, SMG7, SMG7-AS1, TEDDM1"
1,184662478,185279093,616.615,dup,"EDEM3, EDEM3, EDEM3, LINC01633, NIBAN1, RNF2, SWT1, SWT1, TRMT1L, TRMT1L"
1,185877692,186419232,541.54,dup,"HMCN1, ODR4, ODR4, ODR4, PRG4, PRG4, PRG4, PRG4, PRG4, TPR"
1,196641445,197412214,770.769,dup,"ASPM, ASPM, CFH, CFH, CFHR1, CFHR1, CFHR1, CFHR1, CFHR1, CFHR1, CFHR1, CFHR1, CFHR2, CFHR2, CFHR3, CFHR3, CFHR4, CFHR4, CFHR4, CFHR5, CRB1, CRB1, CRB1, CRB1, CRB1, CRB1, F13B, ZBTB41, ZBTB41"
1,198665467,198725526,60.059,dup,"PTPRC, PTPRC, PTPRC, PTPRC"
1,200375175,208392183,8017.008,dup,"ACTG1P25, ADIPOR1, ADIPOR1, ADIPOR1, ADIPOR1, ADORA1, ADORA1, ADORA1, ADORA1, ARL8A, ARL8A, ASCL5, ATP2B4, ATP2B4, ATP2B4, ATP2B4, AVPR1B, BLACAT1, BTG2, C1orf116, C1orf116, C4BPA, C4BPB, C4BPB, C4BPB, C4BPB, C4BPB, CACNA1S, CAMSAP2, CAMSAP2, CAMSAP2, CD34, CD34, CD46, CD46, CD46, CD46, CD46, CD46, CD46, CD46, CD46, CD46, CD46, CD46, CD55, CD55, CD55, CD55, CD55, CD55, CDK18, CDK18, CDK18, CHI3L1, CHIT1, CHIT1, CHIT1, CHIT1, CNTN2, CNTN2, CNTN2, CR1, CR1, CR1, CR1L, CR2, CR2, CSRP1, CSRP1, CSRP1, CSRP1, CTSE, CTSE, CTSE, CYB5R1, DDX59, DDX59, DDX59, DDX59, DDX59, DDX59, DDX59, DDX59, DDX59, DDX59-AS1, DSTYK, DSTYK, DYRK3, DYRK3, EIF2D, EIF2D, ELF3, ELF3, ELF3-AS1, ELK4, ELK4, ERLNC1, ETNK2, ETNK2, ETNK2, ETNK2, FAM72A, FAM72A, FAM72A, FAM72A, FAM72A, FAM72A, FAM72A, FAM72A, FAM72A, FAM72A, FAM72A, FAM72A, FCAMR, FCAMR, FCAMR, FCMR, FCMR, FCMR, FMOD, FMOD, GOLT1A, GPR25, GPR37L1, IGFN1, IGFN1, IKBKE, IKBKE, IKBKE, IL10, IL10, IL10, IL10, IL19, IL19, IL19, IL20, IL20, IL20, IL20, IL24, IL24, IL24, IL24, INAVA, INAVA, INAVA, INAVA, IPO9, IPO9-AS1, KDM5B, KDM5B, KDM5B, KIF14, KIF14, KIF21B, KIF21B, KIF21B, KIF21B, KISS1, KLHDC8A, KLHDC8A, KLHDC8A, KLHDC8A, KLHL12, KLHL12, KLHL12, LAD1, LAX1, LAX1, LAX1, LEMD1, LEMD1, LEMD1, LEMD1, LEMD1, LEMD1-AS1, LEMD1-DT, LGR6, LGR6, LGR6, LINC00260, LINC00303, LINC00628, LINC01136, LINC01136, LINC01353, LINC01353, LINC02767, LINC02767, LMOD1, LOC103021295, LOC107985246, LOC107985246, LOC107985246, LOC148696, LOC284581, LOC284581, LRRN2, LRRN2, MAPKAPK2, MAPKAPK2, MDM4, MDM4, MDM4, MDM4, MDM4, MDM4, MDM4, MFSD4A, MFSD4A-AS1, MFSD4A-AS1, MGAT4EP, MGAT4FP, MIR1231, MIR135B, MIR29B2, MIR29B2CHG, MIR29B2CHG, MIR29C, MIR5191, MIR6739, MIR6740, MIR6769B, MROH3P, MYBPH, MYOG, MYOPARR, NAV1, NAV1, NFASC, NFASC, NFASC, NFASC, NFASC, NFASC, NFASC, NFASC, NFASC, NFASC, NFASC, NUAK2, NUCKS1, OPTC, PCAT6, PCAT6, PFKFB2, PFKFB2, PHLDA3, PHLDA3, PIGR, PIK3C2B, PIK3C2B, PIK3C2B, PKP1, PKP1, PLEKHA6, PLXNA2, PM20D1, PM20D1, PPFIA4, PPFIA4, PPP1R12B, PPP1R12B, PPP1R12B, PPP1R12B, PPP1R12B, PPP1R12B, PPP1R12B, PPP1R15B, PRELP, PRELP, PTPN7, PTPN7, PTPN7, PTPN7, PTPN7, PTPN7, PTPN7, PTPRVP, RAB29, RAB29, RAB29, RAB29, RAB7B, RAB7B, RAB7B, RABIF, RASSF5, RASSF5, RASSF5, RBBP5, RBBP5, RBBP5, REN, RHEX, RHEX, RNPEP, RNPEP, RNPEP, RNPEP, RPS10P7, SHISA4, SHISA4, SLC26A9, SLC26A9, SLC26A9-AS1, SLC26A9-AS1, SLC41A1, SLC45A3, SNORA70H, SNORA77, SNRPE, SNRPE, SNRPE, SNRPE, SNRPE, SOX13, SRGAP2, SRGAP2, SRGAP2, SRGAP2, SRGAP2, SRGAP2, SRGAP2, SYT2, SYT2, TIMM17A, TMCC2, TMCC2, TMCC2, TMCC2, TMCC2, TMCC2, TMCC2, TMEM183A, TMEM183A, TMEM183A, TMEM183A, TMEM183A, TMEM183A, TMEM183A, TMEM183A, TMEM183A, TMEM183A, TMEM183A, TMEM183A, TMEM183A, TMEM183A, TMEM183A, TMEM183A, TMEM183A, TMEM183A, TMEM81, TMEM9, TMEM9, TMEM9, TMEM9, TMEM9, TMEM9, TMEM9, TMEM9, TMEM9, TMEM9, TMEM9, TNNI1, TNNT2, TNNT2, TNNT2, TNNT2, TNNT2, TNNT2, TNNT2, UBE2T, UBE2T, YOD1, YOD1, ZBED6, ZC3H11A, ZC3H11A, ZC3H11A, ZC3H11A, ZC3H11A, ZC3H11A, ZC3H11A, ZC3H11A, ZC3H11A, ZC3H11A, ZC3H11A, ZC3H11A, ZC3H11A, ZC3H11A, ZC3H11A, ZC3H11A, ZC3H11A, ZC3H11A, ZC3H11A, ZC3H11A, ZC3H11A, ZC3H11A, ZC3H11A, ZC3H11A, ZC3H11A, ZC3H11A, ZC3H11A, ZC3H11A, ZC3H11A, ZC3H11A, ZC3H11A, ZC3H11A, ZC3H11A, ZC3H11A, ZC3H11A, ZC3H11A, ZC3H11A, ZC3H11A, ZC3H11A, ZC3H11A, ZC3H11A, ZC3H11A, ZC3H11A, ZNF281, ZNF281, ZNF281"
1,209767558,210025815,258.257,dup,"C1orf74, IRF6, IRF6, SYT14, SYT14, SYT14, SYT14, SYT14, SYT14, TRAF3IP3, TRAF3IP3, TRAF3IP3, TRAF3IP3, TRAF3IP3, UTP25"
1,211444233,213437223,1992.99,dup,"ANGEL2, ANGEL2, ANGEL2, ANGEL2, ANGEL2, ANGEL2, ATF3, ATF3, ATF3, ATF3, ATF3, ATF3, BATF3, DTL, DTL, DTL, FAM71A, FLVCR1, FLVCR1-DT, FLVCR1-DT, INTS7, INTS7, INTS7, INTS7, INTS7, LINC01693, LINC01740, LINC02608, LINC02608, LINC02608, LOC91548, LPGAT1, LPGAT1, LPGAT1, LPGAT1, LPGAT1, LPGAT1, LPGAT1-AS1, LPGAT1-AS1, LPGAT1-AS1, MIR3122, NEK2, NEK2, NEK2, NENF, NENF, NSL1, NSL1, NSL1, NSL1, NSL1, PACC1, PACC1, PACC1, PACC1, PACC1, PACC1, PPP2R5A, PPP2R5A, RD3, RD3, RPL21P28, RPS6KC1, RPS6KC1, RPS6KC1, RPS6KC1, RPS6KC1, RPS6KC1, RPS6KC1, RPS6KC1, RPS6KC1, RPS6KC1, RPS6KC1, RPS6KC1, RPS6KC1, RPS6KC1, RPS6KC1, RPS6KC1, RPS6KC1, RPS6KC1, RPS6KC1, RPS6KC1, RPS6KC1, RPS6KC1, RPS6KC1, RPS6KC1, RPS6KC1, RPS6KC1, RPS6KC1, RPS6KC1, RPS6KC1, RPS6KC1, RPS6KC1, RPS6KC1, RPS6KC1, RPS6KC1, RPS6KC1, SLC30A1, SNORA16B, SPATA45, TATDN3, TATDN3, TATDN3, TATDN3, TATDN3, TATDN3, TATDN3, VASH2, VASH2, VASH2, VASH2"
1,214478264,214837622,359.358,dup,"CENPF, PTPN14"
1,215746531,216501284,754.753,dup,"USH2A, USH2A, USH2A-AS2, USH2A-AS2"
1,220087868,220491270,403.402,dup,"AURKAP1, BPNT1, BPNT1, BPNT1, BPNT1, IARS2, MIR194-1, MIR215, MIR664A, RAB3GAP2, SNORA36B"
1,222695473,223287063,591.59,dup,"AIDA, BROX, BROX, BROX, BROX, BROX, BROX, BROX, DISP1, DISP1, DISP1, DISP1, DISP1, DISP1, DISP1, DISP1, DISP1, DISP1, DISP1, DISP1, DISP1, DISP1, DISP1, DISP1, DISP1, DISP1, DISP1, DISP1, DISP1, DISP1, DISP1, DISP1, DISP1, DISP1, DISP1, DISP1, DISP1, DISP1, DISP1, DISP1, DISP1, DISP1, DISP1, DISP1, DISP1, DISP1, DISP1, DISP1, DISP1, DISP1, DISP1, DISP1, DISP1, DISP1, DISP1, DISP1, DISP1, DISP1, DISP1, DISP1, DISP1, DISP1, FAM177B, FAM177B, FAM177B, SUSD4, SUSD4, TLR5"
1,223930707,224052828,122.121,dup,"GTF2IP20, SEPTIN7P13, SEPTIN7P13, SEPTIN7P13, SEPTIN7P13"
1,224340116,224620395,280.279,dup,"CNIH3, CNIH3, CNIH3, CNIH3, CNIH3, CNIH3, CNIH3, CNIH3, CNIH3, CNIH3, CNIH3, CNIH3, CNIH3, CNIH3, CNIH3, CNIH3, CNIH4, CNIH4, CNIH4, CNIH4, CNIH4, CNIH4, MIR4742, WDR26, WDR26, WDR26"
1,226015790,227336108,1320.318,dup,"ACBD3, ACBD3-AS1, CDC42BPA, CDC42BPA, CDC42BPA, CDC42BPA, CDC42BPA, COQ8A, H3-3A, H3-3A, H3-3A, H3-3A, H3-3A, H3P6, ITPKB, ITPKB-IT1, LIN9, LIN9, LIN9, LIN9, LIN9, LIN9, LIN9, LIN9, LIN9, LINC01703, MIXL1, MIXL1, PARP1, PSEN2, PSEN2, STUM"
1,228284056,228652423,368.367,dup,"BTNL10, DUSP5P1, H2AW, H2BU1, H3-4, MIR4666A, MIR6742, OBSCN, OBSCN, OBSCN, RHOU, RNA5S1, RNA5S1, RNA5S1, RNA5S1, RNA5S1, RNA5S1, RNA5S1, RNA5S1, RNA5S1, RNA5S1, RNA5S10, RNA5S10, RNA5S10, RNA5S10, RNA5S10, RNA5S10, RNA5S10, RNA5S10, RNA5S10, RNA5S10, RNA5S11, RNA5S11, RNA5S11, RNA5S11, RNA5S11, RNA5S11, RNA5S11, RNA5S11, RNA5S11, RNA5S11, RNA5S12, RNA5S12, RNA5S12, RNA5S12, RNA5S12, RNA5S12, RNA5S12, RNA5S12, RNA5S12, RNA5S12, RNA5S13, RNA5S13, RNA5S13, RNA5S13, RNA5S13, RNA5S13, RNA5S13, RNA5S13, RNA5S13, RNA5S13, RNA5S14, RNA5S14, RNA5S14, RNA5S14, RNA5S14, RNA5S14, RNA5S14, RNA5S14, RNA5S14, RNA5S14, RNA5S15, RNA5S15, RNA5S15, RNA5S15, RNA5S15, RNA5S15, RNA5S15, RNA5S15, RNA5S15, RNA5S15, RNA5S16, RNA5S16, RNA5S16, RNA5S16, RNA5S16, RNA5S16, RNA5S16, RNA5S16, RNA5S16, RNA5S16, RNA5S17, RNA5S17, RNA5S17, RNA5S17, RNA5S17, RNA5S17, RNA5S17, RNA5S17, RNA5S17, RNA5S17, RNA5S2, RNA5S2, RNA5S2, RNA5S2, RNA5S2, RNA5S2, RNA5S2, RNA5S2, RNA5S2, RNA5S2, RNA5S3, RNA5S3, RNA5S3, RNA5S3, RNA5S3, RNA5S3, RNA5S3, RNA5S3, RNA5S3, RNA5S3, RNA5S4, RNA5S4, RNA5S4, RNA5S4, RNA5S4, RNA5S4, RNA5S4, RNA5S4, RNA5S4, RNA5S4, RNA5S5, RNA5S5, RNA5S5, RNA5S5, RNA5S5, RNA5S5, RNA5S5, RNA5S5, RNA5S5, RNA5S5, RNA5S6, RNA5S6, RNA5S6, RNA5S6, RNA5S6, RNA5S6, RNA5S6, RNA5S6, RNA5S6, RNA5S6, RNA5S7, RNA5S7, RNA5S7, RNA5S7, RNA5S7, RNA5S7, RNA5S7, RNA5S7, RNA5S7, RNA5S7, RNA5S8, RNA5S8, RNA5S8, RNA5S8, RNA5S8, RNA5S8, RNA5S8, RNA5S8, RNA5S8, RNA5S8, RNA5S9, RNF187, TRIM11, TRIM17, TRIM17, TRIM17"
1,229566337,229795565,229.228,dup,"TAF5L, TAF5L, URB2, URB2"
1,230794564,231510278,715.714,dup,"ARV1, ARV1, ARV1, C1orf131, C1orf131, C1orf198, C1orf198, C1orf198, CAPN9, CAPN9, CAPN9, EGLN1, EGLN1, EGLN1, EXOC8, FAM89A, GNPAT, GNPAT, LOC101927604, MIR1182, SNRPD2P2, SPRTN, SPRTN, SPRTN, TRIM67, TRIM67, TRIM67-AS1, TTC13, TTC13, TTC13, TTC13, TTC13, TTC13, TTC13, TTC13, TTC13, TTC13"
1,232534302,232651418,117.116,dup,"SIPA1L2, SIPA1L2"
1,234444210,234609374,165.164,dup,"IRF2BP2, IRF2BP2, LINC01354, TARBP1"
1,235275040,237061824,1786.784,dup,"ACTN2, ACTN2, ACTN2, ARID4B, ARID4B, ARID4B, ARID4B, B3GALNT2, B3GALNT2, EDARADD, EDARADD, ERO1B, GGPS1, GGPS1, GGPS1, GGPS1, GGPS1, GNG4, GNG4, GNG4, GPR137B, HEATR1, LGALS8, LGALS8, LGALS8, LGALS8, LGALS8-AS1, LYST, LYST, LYST, MIR1537, MT1HL1, MTR, MTR, MTR, NID1, RYR2, TBCE, TBCE, TBCE, TBCE"
1,237659422,238054816,395.394,dup,"LOC100130331, RYR2, ZP4"
1,241660419,242053811,393.392,dup,"BECN2, EXO1, EXO1, EXO1, EXO1, MAP1LC3C, WDR64"
1,246671425,248638389,1966.964,dup,"AHCTF1, AHCTF1, AHCTF1, AHCTF1, C1orf229, FLJ39095, GCSAML, GCSAML, GCSAML, GCSAML, GCSAML, GCSAML, GCSAML, GCSAML-AS1, LINC01341, LOC107985115, LOC107985115, LOC107985115, LOC107985115, MIR3916, NLRP3, NLRP3, NLRP3, NLRP3, NLRP3, NLRP3, OR11L1, OR13G1, OR14A16, OR14A2, OR14C36, OR14K1, OR1C1, OR2AJ1, OR2AK2, OR2B11, OR2C3, OR2G2, OR2G3, OR2G6, OR2L13, OR2L13, OR2L1P, OR2L2, OR2L3, OR2L5, OR2L8, OR2M1P, OR2M2, OR2M3, OR2M4, OR2M5, OR2M7, OR2T1, OR2T10, OR2T11, OR2T12, OR2T2, OR2T29, OR2T3, OR2T33, OR2T34, OR2T35, OR2T4, OR2T5, OR2T5, OR2T6, OR2T7, OR2T8, OR2W3, OR2W5, OR6F1, SCCPDH, TRIM58, VN1R5, VN1R5, ZNF124, ZNF124, ZNF124, ZNF124, ZNF124, ZNF496, ZNF496, ZNF669, ZNF669, ZNF670, ZNF670, ZNF670-ZNF695, ZNF695, ZNF695, ZNF695"
2,3404401,3750746,346.345,dup,"ADI1, ADI1, ALLC, COLEC11, COLEC11, COLEC11, COLEC11, COLEC11, COLEC11, COLEC11, COLEC11, COLEC11, COLEC11, COLEC11, DCDC2C, DCDC2C, RNASEH1, RNASEH1, RNASEH1, RNASEH1, RNASEH1, RNASEH1, RNASEH1, RNASEH1, RNASEH1, RNASEH1, RNASEH1, RNASEH1, RNASEH1, RNASEH1-AS1, RNASEH1-AS1, RNASEH1-AS1, RPS7, TRAPPC12, TRAPPC12"
2,8869861,9029019,159.158,dup,"MBOAT2, MBOAT2, MBOAT2, MBOAT2, MBOAT2, MBOAT2, MBOAT2, MBOAT2, MBOAT2, MBOAT2, MBOAT2, MBOAT2, MBOAT2"
2,9458449,11965953,2507.504,dup,"ADAM17, ADAM17, ADAM17, ATP6V1C2, ATP6V1C2, C2orf50, C2orf50, C2orf50, CPSF3, CPSF3, CPSF3, CPSF3, CPSF3, CYS1, E2F6, E2F6, E2F6, E2F6, E2F6, E2F6, E2F6, FLJ33534, GREB1, GREB1, GREB1, GRHL1, HPCAL1, HPCAL1, HPCAL1, HPCAL1, HPCAL1, IAH1, IAH1, IAH1, IAH1, IAH1, KCNF1, KLF11, KLF11, KLF11, LINC00570, LINC01954, LOC101929882, LPIN1, LPIN1, LPIN1, LPIN1, LPIN1, LPIN1, LPIN1, LPIN1, LPIN1, LPIN1, LPIN1, LPIN1, LPIN1, LPIN1, MIR4261, MIR4262, MIR4429, MIR548S, NOL10, NOL10, NOL10, NOL10, NTSR2, ODC1, ODC1, ODC1, ODC1, ODC1-DT, PDIA6, PDIA6, PDIA6, PDIA6, PDIA6, RN7SL832P, ROCK2, ROCK2, RRM2, RRM2, RRM2, SLC66A3, SLC66A3, SLC66A3, SLC66A3, SLC66A3, SNORA80B, TAF1B, TAF1B, TAF1B, YWHAQ"
2,15415400,15771755,356.355,dup,"DDX1, LINC01804, NBAS, NBAS"
2,17691674,17963945,272.271,dup,"GEN1, GEN1, KCNS3, KCNS3, MSGN1, SMC6, SMC6"
2,20096076,21266244,1170.168,dup,"APOB, GDF7, HS1BP3, HS1BP3-IT1, LDAH, LDAH, LDAH, LDAH, LDAH, LDAH, LDAH, LDAH, LOC107985856, PUM2, PUM2, PUM2, PUM2, PUM2, PUM2, PUM2, PUM2, PUM2, PUM2, PUM2, PUM2, PUM2, PUM2, PUM2, RHOB, SDC1, SDC1, TDRD15"
2,23976953,29551521,5574.568,dup,"ABHD1, ADCY3, ADCY3, ADCY3, ADCY3, ADCY3, ADCY3, ADCY3, ADGRF3, ADGRF3, ADGRF3, ADGRF3, ADGRF3, ADGRF3, AGBL5, AGBL5, AGBL5, AGBL5, AGBL5-AS1, ALK, ALK, ASXL2, ASXL2, ASXL2, ATRAID, ATRAID, BABAM2, BABAM2, BABAM2, BABAM2, BABAM2, BABAM2, BABAM2, BABAM2, BABAM2, BABAM2, BABAM2, BABAM2, BABAM2, BABAM2, BABAM2-AS1, C2orf16, CAD, CAD, CCDC121, CCDC121, CENPA, CENPA, CENPO, CENPO, CENPO, CENPO, CENPO, CENPO, CGREF1, CGREF1, CGREF1, CGREF1, CIB4, CLIP4, CLIP4, CLIP4, CLIP4, DNAJC27, DNAJC27, DNAJC27-AS1, DNAJC5G, DNAJC5G, DNAJC5G, DNAJC5G, DNMT3A, DNMT3A, DNMT3A, DNMT3A, DNMT3A, DNMT3A, DNMT3A, DNMT3A, DPYSL5, DPYSL5, DPYSL5, DRC1, DTNB, DTNB, DTNB, DTNB, DTNB, DTNB, DTNB, DTNB, DTNB, DTNB, DTNB, DTNB, DTNB, DTNB, DTNB, DTNB, DTNB, DTNB, DTNB, DTNB, DTNB, DTNB, DTNB, DTNB, DTNB, DTNB, DTNB, DTNB, DTNB, DTNB, EFR3B, EFR3B, EIF2B4, EIF2B4, EIF2B4, EIF2B4, EIF2B4, EIF2B4, EIF2B4, EIF2B4, EMILIN1, FAM166C, FAM166C, FAM228A, FAM228B, FAM228B, FAM228B, FKBP1B, FKBP1B, FKBP1B, FKBP1B, FKBP1B, FKBP1B, FKBP1B, FLJ31356, FNDC4, FOSL2, FTH1P3, GAREM2, GAREM2, GCKR, GPN1, GPN1, GPN1, GPN1, GPN1, GTF3C2, GTF3C2, GTF3C2, GTF3C2-AS1, HADHA, HADHB, HADHB, HADHB, IFT172, ITSN2, ITSN2, ITSN2, ITSN2, ITSN2, ITSN2, ITSN2, ITSN2, ITSN2, KCNK3, KHK, KHK, KIF3C, KRTCAP3, KRTCAP3, KRTCAP3, LINC01381, LINC01460, LOC100505716, LOC100505736, LOC100505774, LOC105374378, LOC105374389, MAPRE3, MAPRE3, MAPRE3-AS1, MFSD2B, MIR1301, MIR4263, MPV17, MRPL33, MRPL33, NCOA1, NCOA1, NCOA1, NCOA1, NCOA1, NCOA1, NCOA1, NRBP1, NRBP1, NRBP1, NRBP1, NRBP1, NRBP1, NRBP1, OST4, OTOF, OTOF, OTOF, OTOF, OTOF, PCARE, PFN4, PLB1, PLB1, PLB1, POMC, POMC, POMC, POMC, PPM1G, PPP1CB, PPP1CB, PREB, PREB, PREB, PREB, PREB, PREB, PRR30, PTRHD1, RAB10, RBKS, RBKS, SELENOI, SELENOI, SF3B6, SLC30A3, SLC30A3, SLC30A3, SLC30A3, SLC35F6, SLC4A1AP, SLC5A6, SLC5A6, SNORD53, SNORD53B, SNORD92, SNX17, SNX17, SNX17, SNX17, SNX17, SNX17, SNX17, SNX17, SNX17, SNX17, SNX17, SPDYA, SPDYA, SPDYA, SUPT7L, SUPT7L, SUPT7L, SUPT7L, SUPT7L, TCF23, TMEM214, TMEM214, TOGARAM2, TOGARAM2, TOGARAM2, TP53I3, TP53I3, TP53I3, TRIM54, TRIM54, TRMT61B, UBXN2A, UCN, WDCP, WDCP, WDR43, ZNF512, ZNF512, ZNF512, ZNF512, ZNF512, ZNF512, ZNF513, ZNF513"
2,31457426,31638606,181.18,dup,SRD5A2
2,32339307,33827793,1488.486,dup,"BIRC6, BIRC6, BIRC6-AS2, FAM98A, FAM98A, LINC00486, LINC00486, LINC00486, LINC01317, LTBP1, LTBP1, LTBP1, LTBP1, LTBP1, MIR4430, MIR4765, MIR558, MYADML, RASGRP3, RASGRP3, RASGRP3, RASGRP3, RASGRP3, RASGRP3, RASGRP3, RASGRP3, RASGRP3, RASGRP3, RASGRP3-AS1, TTC27, TTC27"
