chromosome,st_bp,end_bp,length_kb,cnv_type,overlapping_genes
11,57067010,68855786,11788.776,dup,"ACTN3, ACTN3, ACTN3, ACY3, AHNAK, AHNAK, AHNAK, AHNAK, AIP, AIP, AIP, ALDH3B1, ALDH3B1, ALDH3B1, ALDH3B1, ALDH3B1, ALDH3B2, ALDH3B2, ANKRD13D, ANKRD13D, AP5B1, APLNR, APLNR, ARL2, ARL2, ARL2-SNX15, ASRGL1, ASRGL1, ATG2A, ATG2A, ATG2A, ATL3, ATL3, B3GAT3, B3GAT3, B3GAT3, B3GAT3, B3GAT3, B4GAT1, BAD, BAD, BANF1, BANF1, BATF2, BATF2, BATF2, BBS1, BEST1, BEST1, BEST1, BEST1, BEST1, BEST1, BEST1, BEST1, BRMS1, BRMS1, BSCL2, BSCL2, BSCL2, BSCL2, BSCL2, BTBD18, C11orf24, C11orf24, C11orf68, C11orf68, C11orf72, C11orf80, C11orf80, C11orf86, C11orf86, C11orf95, C11orf98, C11orf98, CABP2, CABP2, CABP4, CABP4, CABP4, CABP4, CABP4, CAPN1, CAPN1, CAPN1, CAPN1, CARNS1, CARNS1, CATSPER1, CATSPERZ, CBLIF, CCDC85B, CCDC86, CCDC87, CCDC88B, CCS, CD248, CD5, CD5, CD6, CD6, CD6, CD6, CDC42BPG, CDC42EP2, CDCA5, CDK2AP2, CDK2AP2, CDK2AP2, CFL1, CHKA, CHKA, CHKA, CHKA, CHKA, CHKA, CHKA, CHRM1, CLCF1, CLCF1, CLP1, CLP1, CNIH2, CNIH2, CNIH2, CNTF, CORO1B, CORO1B, COX8A, CPSF7, CPSF7, CPSF7, CPSF7, CPSF7, CPSF7, CPSF7, CPSF7, CPSF7, CPSF7, CPSF7, CPT1A, CPT1A, CSKMT, CST6, CTNND1, CTNND1, CTNND1, CTNND1, CTNND1, CTNND1, CTNND1, CTNND1, CTNND1, CTNND1, CTNND1, CTNND1, CTNND1, CTNND1, CTNND1, CTNND1, CTNND1, CTNND1, CTNND1, CTNND1, CTNND1, CTNND1, CTSF, CTSW, CYB561A3, CYB561A3, CYB561A3, CYB561A3, DAGLA, DDB1, DNAJC4, DNAJC4, DNAJC4, DOC2GP, DPF2, DPF2, DPP3, DPP3, DPP3, DRAP1, DTX4, DTX4, EEF1G, EFEMP2, EFEMP2, EHBP1L1, EHBP1L1, EHD1, EHD1, EHD1, EIF1AD, EIF1AD, EIF1AD, EIF1AD, EIF1AD, EIF1AD, EIF1AD, EML3, EML3, EML3, ESRRA, ESRRA, ESRRA, FADS1, FADS2, FADS2, FADS2, FADS3, FAM111A, FAM111A, FAM111A, FAM111A, FAM111A, FAM111A, FAM111A, FAM111A, FAM111A, FAM111A, FAM111A, FAM111A, FAM111A, FAM111A, FAM111A, FAM111A, FAM111A, FAM111A, FAM111A, FAM111A, FAM111A, FAM111A, FAM111A, FAM111A, FAM111A, FAM111A, FAM111A, FAM111A, FAM111A, FAM111A, FAM111A, FAM111A, FAM111A, FAM111A-DT, FAM111B, FAM111B, FAM111B, FAM86C2P, FAM89B, FAM89B, FAM89B, FAU, FEN1, FERMT3, FERMT3, FERMT3, FERMT3, FERMT3, FERMT3, FERMT3, FIBP, FIBP, FKBP2, FKBP2, FKBP2, FKBP2, FKBP2, FKBP2, FKBP2, FKBP2, FLRT1, FLRT1, FOSL1, FOSL1, FOSL1, FOSL1, FOSL1, FOSL1, FRMD8, FRMD8, FRMD8, FTH1, GAL, GAL3ST3, GANAB, GANAB, GANAB, GANAB, GANAB, GANAB, GANAB, GANAB, GANAB, GLYAT, GLYAT, GLYATL1, GLYATL1, GLYATL1, GLYATL1, GLYATL1B, GLYATL2, GNG3, GPHA2, GPR137, GPR137, GPR137, GPR137, GPR137, GPR137, GPR137, GPR137, GPR137, GPR137, GPR137, GPR137, GPR137, GPR137, GPR137, GPR137, GPR137, GPR137, GPR137, GPR137, GPR137, GPR137, GPR152, GRK2, GSTP1, HNRNPUL2, HNRNPUL2-BSCL2, INCENP, INCENP, INTS5, KAT5, KAT5, KAT5, KAT5, KCNK4, KCNK4, KCNK4, KCNK4, KCNK4-TEX40, KCNK7, KCNK7, KCNK7, KCNK7, KDM2A, KDM2A, KDM2A, KLC2, KLC2, KLC2, KLC2, KLC2, KMT5B, KMT5B, KMT5B, KMT5B, KMT5B, KMT5B, KMT5B, KMT5B, KMT5B, KMT5B, KMT5B, KMT5B, KMT5B, KMT5B, KMT5B, KMT5B, KMT5B, KMT5B, KMT5B, LBHD1, LBHD1, LBHD1, LBHD1, LGALS12, LGALS12, LGALS12, LGALS12, LGALS12, LINC00301, LINC02724, LOC100130987, LOC101927495, LOC101927789, LOC101927789, LOC101927789, LOC101928069, LOC102724064, LOC105369332, LOC107984341, LOC114841035, LOC283194, LOC728975, LPXN, LPXN, LPXN, LRFN4, LRFN4, LRP5, LRP5, LRRC10B, LRRC55, LRRN4CL, LTBP3, LTBP3, LTBP3, MACROD1, MAJIN, MAJIN, MAJIN, MALAT1, MALAT1, MALAT1, MAP3K11, MAP4K2, MAP4K2, MARK2, MARK2, MARK2, MARK2, MARK2, MASCRNA, MED19, MED19, MED19, MEN1, MEN1, MEN1, MEN1, MEN1, MEN1, MEN1, MEN1, MEN1, MEN1, MEN1, MEN1, MEN1, MIR10392, MIR1237, MIR130A, MIR1908, MIR192, MIR194-2, MIR194-2HG, MIR194-2HG, MIR194-2HG, MIR3162, MIR3163, MIR3654, MIR4488, MIR4489, MIR4690, MIR4691, MIR611, MIR612, MIR6503, MIR6514, MIR6746, MIR6747, MIR6748, MIR6749, MIR6750, MIR6751, MIR6752, MIR6753, MIR6860, MIR6879, MIR7113, MIR7155, MPEG1, MRPL11, MRPL11, MRPL11, MRPL11, MRPL11, MRPL16, MRPL49, MRPL49, MRPL49, MS4A1, MS4A1, MS4A1, MS4A10, MS4A12, MS4A12, MS4A13, MS4A13, MS4A13, MS4A14, MS4A14, MS4A14, MS4A14, MS4A14, MS4A14, MS4A14, MS4A14, MS4A15, MS4A15, MS4A15, MS4A15, MS4A18, MS4A2, MS4A2, MS4A3, MS4A3, MS4A3, MS4A4A, MS4A4A, MS4A4A, MS4A4E, MS4A5, MS4A6A, MS4A6A, MS4A6A, MS4A6A, MS4A6A, MS4A6E, MS4A6E, MS4A7, MS4A7, MS4A7, MS4A7, MS4A8, MTA2, MTA2, MUS81, MUS81, MUS81, MYRF, MYRF, MYRF-AS1, NAA40, NAA40, NAALADL1, NDUFS8, NDUFV1, NDUFV1, NEAT1, NEAT1, NPAS4, NPAS4, NRXN2, NRXN2, NRXN2, NRXN2, NRXN2, NRXN2, NRXN2, NRXN2, NUDT22, NUDT22, NUDT22, NUDT22, NUDT8, NUDT8, NXF1, NXF1, OOSP1, OOSP2, OOSP4B, OR10Q1, OR10V1, OR10V2P, OR10W1, OR1S1, OR1S2, OR4D10, OR4D11, OR4D6, OR4D9, OR5A1, OR5A2, OR5AN1, OR5B12, OR5B17, OR5B2, OR5B21, OR5B3, OR6Q1, OR9I1, OR9Q1, OR9Q2, OSBP, OTUB1, OTUB1, OVOL1, OVOL1-AS1, P2RX3, PACS1, PATL1, PC, PC, PC, PCNX3, PELI3, PELI3, PELI3, PELI3, PGA3, PGA4, PGA5, PITPNM1, PITPNM1, PLAAT2, PLAAT3, PLAAT3, PLAAT4, PLAAT5, PLAAT5, PLAAT5, PLCB3, PLCB3, PLCB3, POLA2, POLD4, POLD4, POLD4, POLD4, POLD4, POLR2G, PPP1CA, PPP1CA, PPP1CA, PPP1R14B, PPP1R14B-AS1, PPP1R14B-AS1, PPP1R32, PPP1R32, PPP2R5B, PPP6R3, PPP6R3, PPP6R3, PPP6R3, PPP6R3, PPP6R3, PPP6R3, PPP6R3, PPP6R3, PPP6R3, PPP6R3, PPP6R3, PPP6R3, PPP6R3, PPP6R3, PPP6R3, PPP6R3, PPP6R3, PPP6R3, PPP6R3, PPP6R3, PPP6R3, PPP6R3, PPP6R3, PPP6R3, PPP6R3, PPP6R3, PPP6R3, PPP6R3, PPP6R3, PPP6R3, PPP6R3, PPP6R3, PPP6R3, PPP6R3, PPP6R3, PPP6R3, PPP6R3, PPP6R3, PPP6R3, PPP6R3, PPP6R3, PPP6R3, PPP6R3, PPP6R3, PRDX5, PRDX5, PRDX5, PRDX5, PRDX5, PRG2, PRG2, PRG2, PRG2, PRG3, PRPF19, PTGDR2, PTPRCAP, PYGM, PYGM, RAB1B, RAB3IL1, RAB3IL1, RAD9A, RAD9A, RASGRP2, RASGRP2, RASGRP2, RASGRP2, RBM14, RBM14, RBM14, RBM14-RBM4, RBM14-RBM4, RBM4, RBM4, RBM4, RBM4B, RBM4B, RCE1, RCE1, RCOR2, RCOR2, RELA, RELA, RELA, RELA, RHOD, RHOD, RIN1, RIN1, RIN1, RNASEH2C, ROM1, RPLP0P2, RPS6KA4, RPS6KA4, RPS6KA4, RPS6KA4, RPS6KB2, RTN3, RTN3, RTN3, RTN3, RTN3, RTN3, RTN3, RTN3, RTN3, RTN4RL2, SAC3D1, SAC3D1, SAC3D1, SAC3D1, SAC3D1, SAC3D1, SAC3D1, SART1, SCGB1A1, SCGB1D1, SCGB1D2, SCGB1D4, SCGB2A1, SCGB2A2, SCYL1, SCYL1, SDHAF2, SELENOH, SELENOH, SERPING1, SERPING1, SF1, SF1, SF1, SF1, SF1, SF1, SF1, SF1, SF1, SF1, SF1, SF1, SF3B2, SIPA1, SIPA1, SLC15A3, SLC15A3, SLC22A10, SLC22A10, SLC22A11, SLC22A11, SLC22A12, SLC22A12, SLC22A12, SLC22A12, SLC22A20P, SLC22A24, SLC22A24, SLC22A25, SLC22A6, SLC22A6, SLC22A6, SLC22A6, SLC22A8, SLC22A8, SLC22A8, SLC22A8, SLC22A9, SLC25A45, SLC25A45, SLC25A45, SLC25A45, SLC25A45, SLC25A45, SLC25A45, SLC25A45, SLC25A45, SLC25A45, SLC25A45, SLC29A2, SLC29A2, SLC29A2, SLC29A2, SLC3A2, SLC3A2, SLC3A2, SLC3A2, SLC3A2, SLC43A1, SLC43A1, SLC43A3, SLC43A3, SLC43A3, SLC43A3, SLC43A3, SMTNL1, SNHG1, SNHG1, SNHG1, SNHG1, SNHG1, SNHG1, SNHG1, SNHG1, SNHG1, SNHG1, SNHG1, SNHG1, SNORA57, SNORD13F, SNORD22, SNORD25, SNORD26, SNORD27, SNORD28, SNORD29, SNORD30, SNORD31, SNX15, SNX15, SNX32, SPDYC, SPINDOC, SPTBN2, SSH3, SSRP1, STIP1, STIP1, STIP1, STX3, STX3, STX5, STX5, STX5, SYT12, SYT12, SYT12, SYT12, SYT7, SYT7, SYT7, SYT7, SYT7, SYT7, SYVN1, SYVN1, TAF6L, TALAM1, TBC1D10C, TBC1D10C, TBC1D10C, TBC1D10C, TBC1D10C, TBC1D10C, TBC1D10C, TBC1D10C, TBC1D10C, TBX10, TCIRG1, TCIRG1, TCIRG1, TCN1, TESMIN, TESMIN, TIGD3, TIMM10, TKFC, TKFC, TKFC, TKFC, TKFC, TKFC, TM7SF2, TM7SF2, TM7SF2, TMEM109, TMEM132A, TMEM132A, TMEM134, TMEM134, TMEM134, TMEM134, TMEM134, TMEM134, TMEM134, TMEM134, TMEM138, TMEM138, TMEM138, TMEM151A, TMEM179B, TMEM179B, TMEM179B, TMEM179B, TMEM216, TMEM216, TMEM216, TMEM216, TMEM223, TMEM258, TMEM262, TMEM262, TMX2, TMX2, TMX2, TMX2, TMX2, TMX2, TMX2, TMX2, TMX2, TMX2, TMX2, TMX2, TMX2, TMX2, TMX2-CTNND1, TNKS1BP1, TRMT112, TRMT112, TRMT112, TRMT112, TRMT112, TRPT1, TRPT1, TRPT1, TRPT1, TRPT1, TRPT1, TRPT1, TSGA10IP, TTC9C, TTC9C, TTC9C, TTC9C, TTC9C, TTC9C, TUT1, TUT1, UBE2L6, UBE2L6, UBXN1, UBXN1, UBXN1, UNC93B1, UQCC3, VEGFB, VEGFB, VPS37C, VPS51, VPS51, VWCE, WDR74, WDR74, WDR74, WDR74, WDR74, WDR74, WDR74, WDR74, WDR74, YIF1A, YIF1A, YPEL4, YPEL4, ZBTB3, ZBTB3, ZBTB3, ZDHHC24, ZDHHC24, ZDHHC5, ZFP91, ZFP91, ZFP91-CNTF, ZFPL1, ZNHIT2, ZNRD2, ZNRD2, ZNRD2-AS1, ZP1"
11,70118048,70349278,231.23,dup,"ANO1, ANO1, ANO1, ANO1, ANO1, ANO1, ANO1, ANO1, FADD, MIR548K, PPFIA1, PPFIA1, PPFIA1, PPFIA1"
11,71145074,78444365,7299.291,dup,"AAMDC, AAMDC, AAMDC, AAMDC, AAMDC, AAMDC, AAMDC, AAMDC, ACER3, ACER3, ACER3, ACER3, ACTE1P, ALG1L9P, ALG1L9P, ALG1L9P, ALG8, ALG8, ANAPC15, ANAPC15, ANAPC15, ANAPC15, ANAPC15, ANAPC15, ANAPC15, ANAPC15, ANAPC15, ANAPC15, ANAPC15, ANAPC15, AQP11, AQP11, ARAP1, ARAP1, ARAP1, ARAP1, ARAP1, ARAP1-AS2, ARHGEF17, ARRB1, ARRB1, ATG16L2, ATG16L2, B3GNT6, C2CD3, C2CD3, CAPN5, CHRDL2, CHRDL2, CHRDL2, CHRDL2, CHRDL2, CHRDL2, CHRDL2, CLNS1A, CLNS1A, CLNS1A, CLNS1A, CLNS1A, CLPB, CLPB, CLPB, CLPB, COA4, DEFB108B, DEFB131B, DGAT2, DGAT2, DHCR7, DHCR7, DNAJB13, DNAJB13, EMSY, EMSY, EMSY, EMSY, FAM168A, FAM168A, FAM168A, FCHSD2, FOLR1, FOLR1, FOLR1, FOLR1, FOLR2, FOLR2, FOLR2, FOLR2, FOLR3, FOLR3, GAB2, GAB2, GDPD4, GDPD5, GDPD5, GDPD5, GUCY2EP, GVQW3, GVQW3, GVQW3, GVQW3, GVQW3, IL18BP, IL18BP, IL18BP, IL18BP, IL18BP, IL18BP, IL18BP, INPPL1, INTS4, KCNE3, KCTD14, KCTD14, KCTD21, KCTD21-AS1, KCTD21-AS1, KLHL35, KRTAP5-10, KRTAP5-11, KRTAP5-7, KRTAP5-8, KRTAP5-9, LAMTOR1, LINC01537, LINC02728, LIPT2, LIPT2, LIPT2, LOC100128494, LOC100133315, LOC100133315, LOC100287837, LOC100287896, LOC101928837, LOC101928837, LOC105369391, LOC283214, LOC646029, LRRC32, LRRC32, LRRC32, LRRC32, LRRC32, LRRC32, LRRC32, LRRC32, LRTOMT, LRTOMT, LRTOMT, LRTOMT, LRTOMT, LRTOMT, LRTOMT, LRTOMT, LRTOMT, LRTOMT, MAP6, MAP6, MIR139, MIR3165, MIR326, MIR4692, MIR4696, MIR548AL, MIR6754, MOGAT2, MRPL48, MRPL48, MRPL48, MRPL48, MRPL48, MRPL48, MRPL48, MRPL48, MYO7A, MYO7A, MYO7A, NADSYN1, NARS2, NARS2, NDUFC2, NDUFC2, NDUFC2, NDUFC2-KCTD14, NDUFC2-KCTD14, NDUFC2-KCTD14, NEU3, NEU3, NEU3, NEU3, NEU3, NEU3, NEU3, NEU3, NEU3, NUMA1, NUMA1, NUMA1, OMP, OR2AT4, P2RY2, P2RY2, P2RY2, P2RY6, P2RY6, P2RY6, P2RY6, P2RY6, P2RY6, P2RY6, P2RY6, P4HA3, P4HA3, P4HA3, P4HA3-AS1, PAAF1, PAAF1, PAAF1, PAAF1, PAAF1, PAAF1, PAK1, PAK1, PAK1, PAK1, PAK1, PAK1, PAK1, PAK1, PAK1, PAK1, PAK1, PAK1, PAK1, PAK1, PAK1, PAK1, PAK1, PAK1, PAK1, PAK1, PAK1, PAK1, PAK1, PAK1, PAK1, PAK1, PAK1, PAK1, PAK1, PAK1, PAK1, PAK1, PAK1, PAK1, PAK1, PAK1, PAK1, PDE2A, PDE2A, PDE2A, PDE2A, PGM2L1, PHOX2A, PLEKHB1, PLEKHB1, PLEKHB1, PLEKHB1, PLEKHB1, POLD3, POLD3, POLD3, POLD3, PPME1, PPME1, RAB6A, RAB6A, RAB6A, RAB6A, RELT, RELT, RNF121, RNF121, RNF121, RNF121, RNF169, RPS3, RPS3, RPS3, RPS3, RSF1, SERPINH1, SERPINH1, SHANK2, SLCO2B1, SLCO2B1, SLCO2B1, SNORD15A, SNORD15B, SPCS2, STARD10, THAP12, THAP12, THRSP, TPBGL, TSKU, TSKU, TSKU, TSKU, TSKU, UCP2, UCP2, UCP2, UCP2, UCP2, UCP2, UCP2, UCP2, UCP3, UCP3, USP35, UVRAG, UVRAG-DT, WNT11, XRRA1, XRRA1, XRRA1, XRRA1, XRRA1, XRRA1, XRRA1, XRRA1, XRRA1, XRRA1, XRRA1, XRRA1, XRRA1, XRRA1, XRRA1, XRRA1, XRRA1, XRRA1, XRRA1, XRRA1, XRRA1, XRRA1, XRRA1, XRRA1, XRRA1, XRRA1, XRRA1, XRRA1, XRRA1, ZNF705E"
11,82515433,82991908,476.475,dup,"DDIAS, DDIAS, FAM181B, PRCP, PRCP, PRCP, RAB30, RAB30, RAB30, RAB30"
11,85342257,86220133,877.876,dup,"CCDC83, CCDC83, CCDC89, CREBZF, CREBZF, CREBZF, CREBZF, CREBZF, CREBZF, CREBZF, CREBZF, CREBZF, CREBZF, CREBZF, CREBZF, CREBZF, CREBZF, CREBZF, CREBZF, CREBZF, CREBZF, DLG2, DLG2, DLG2, PICALM, PICALM, PICALM, PICALM, SYTL2, SYTL2, SYTL2, SYTL2, SYTL2, SYTL2, SYTL2, SYTL2, SYTL2, SYTL2, SYTL2, SYTL2, SYTL2, SYTL2, SYTL2, SYTL2, SYTL2, SYTL2, SYTL2, SYTL2, SYTL2, TMEM126A, TMEM126A, TMEM126B, TMEM126B, TMEM126B, TMEM126B, TMEM126B, TMEM126B, TMEM126B, TMEM126B, TMEM126B, TMEM126B, TMEM126B"
11,92494402,92715622,221.22,dup,"FAT3, FAT3, FAT3"
11,93454361,94926831,1472.47,dup,"AMOTL1, AMOTL1, ANKRD49, C11orf54, C11orf54, C11orf54, C11orf54, C11orf54, C11orf54, C11orf54, C11orf54, C11orf54, C11orf54, C11orf54, C11orf54, C11orf54, C11orf54, C11orf54, C11orf54, C11orf97, CEP295, FUT4, GPR83, GPR83, HEPHL1, IZUMO1R, LOC105369438, LOC105369438, LOC105369438, MED17, MIR1304, MIR548L, MRE11, MRE11, MRE11, PANX1, PIWIL4, SCARNA9, SMCO4, SNORA1, SNORA18, SNORA25, SNORA32, SNORA40, SNORA8, SNORD5, SNORD6, TAF1D, TAF1D, TAF1D, VSTM5"
11,95504409,95599503,95.094,dup,
11,101761660,103159055,1397.395,dup,"ANGPTL5, BIRC2, BIRC2, BIRC2, BIRC3, BIRC3, CEP126, CEP126, CFAP300, CFAP300, CFAP300, DCUN1D5, DCUN1D5, DCUN1D5, DCUN1D5, DYNC2H1, DYNC2H1, LOC101928424, LOC102723838, MMP1, MMP1, MMP10, MMP12, MMP13, MMP20, MMP27, MMP3, MMP7, MMP8, MMP8, MMP8, TMEM123, WTAPP1, YAP1, YAP1, YAP1, YAP1, YAP1, YAP1, YAP1, YAP1, YAP1"
11,104814710,105010905,196.195,dup,"CASP12, CASP12, CASP12, CASP12, CASP12, CASP12, CASP12, CASP12, CASP12, CASP12, CASP4, CASP4, CASP4LP, CASP4LP, CASP5, CASP5, CASP5, CASP5, CASP5, CASP5"
11,107916809,108594485,677.676,dup,"ACAT1, ATM, ATM, ATM, ATM, C11orf65, C11orf65, C11orf65, C11orf65, CUL5, EXPH5, EXPH5, EXPH5, EXPH5, EXPH5, NPAT, NPAT, POGLUT3, POGLUT3, POGLUT3, RAB39A"
11,111365254,112140027,774.773,dup,"ALG9, ALG9, ALG9, ALG9, ALG9, ALG9, ALG9, ALG9, ALG9, ALG9, ALG9, ALG9, ALG9, ALG9, ALG9, ALG9, ALG9, ALG9, ALG9, ALG9, BTG4, BTG4, BTG4, BTG4, C11orf1, C11orf1, C11orf52, CRYAB, CRYAB, CRYAB, CRYAB, CRYAB, CRYAB, DIXDC1, DIXDC1, DIXDC1, DLAT, DLAT, DLAT, DLAT, DLAT, DLAT, DLAT, DLAT, DLAT, DLAT, DLAT, DLAT, DLAT, DLAT, FDXACB1, FDXACB1, HOATZ, HOATZ, HSPB2, HSPB2-C11orf52, LAYN, LAYN, LAYN, LAYN, LOC100132078, LOC728196, MIR34B, MIR34C, NKAPD1, NKAPD1, NKAPD1, NKAPD1, NKAPD1, NKAPD1, NKAPD1, PIH1D2, PIH1D2, POU2AF1, PPP2R1B, PPP2R1B, PPP2R1B, PPP2R1B, PPP2R1B, SDHD, SDHD, SDHD, SDHD, SDHD, SIK2, TIMM8B, TIMM8B, TIMM8B"
11,113072960,114466351,1393.391,dup,"ANKK1, C11orf71, C11orf71, CLDN25, DRD2, DRD2, HTR3A, HTR3A, HTR3A, HTR3A, HTR3B, HTR3B, LOC101928940, MIR4301, NCAM1, NCAM1, NCAM1, NCAM1, NCAM1, NCAM1-AS1, NNMT, NNMT, NNMT, NNMT, NNMT, RBM7, RBM7, RBM7, RBM7, RBM7, REXO2, TMPRSS5, TMPRSS5, TMPRSS5, TMPRSS5, TMPRSS5, TMPRSS5, TMPRSS5, TTC12, TTC12, TTC12, TTC12, TTC12, TTC12, TTC12, TTC12, TTC12, USP28, USP28, USP28, USP28, USP28, USP28, USP28, USP28, USP28, USP28, USP28, USP28, USP28, USP28, USP28, USP28, USP28, USP28, USP28, USP28, USP28, USP28, ZBTB16, ZBTB16, ZBTB16, ZBTB16, ZBTB16, ZW10"
11,116618502,121501379,4882.877,dup,"ABCG4, ABCG4, ABCG4, ABCG4, APOA1, APOA1, APOA1, APOA1, APOA1-AS, APOA4, APOA5, APOA5, APOA5, APOC3, ARCN1, ARCN1, ARHGEF12, ARHGEF12, ARHGEF12, ATP5MG, ATP5MG, BACE1, BACE1, BACE1, BACE1, BACE1, BACE1, BACE1-AS, BCL9L, BCL9L, BCL9L, BCL9L, BUD13, BUD13, C1QTNF5, C1QTNF5, C2CD2L, C2CD2L, C2CD2L, C2CD2L, C2CD2L, CBL, CCDC153, CD3D, CD3D, CD3E, CD3G, CENATAC, CENATAC, CENATAC, CENATAC, CEP164, CEP164, CXCR5, CXCR5, DDX6, DDX6, DPAGT1, DSCAML1, DSCAML1, DSCAML1, FOXR1, FXYD2, FXYD2, FXYD6, FXYD6, FXYD6, FXYD6, FXYD6, FXYD6-FXYD2, FXYD6-FXYD2, GRIK4, GRIK4, GRIK4, H2AX, HINFP, HINFP, HINFP, HINFP, HINFP, HINFP, HINFP, HINFP, HINFP, HINFP, HINFP, HINFP, HINFP, HINFP, HINFP, HINFP, HINFP, HMBS, HMBS, HMBS, HMBS, HYOU1, HYOU1, IFT46, IFT46, IL10RA, IL10RA, JAML, JAML, JAML, JAML, JAML, KMT2A, KMT2A, LINC02702, LOC100131626, LOC100131626, LOC100652768, LOC101929089, LOC101929089, LOC101929089, LOC101929089, LOC101929089, LOC101929208, LOC101929227, LOC102724301, LOC105369532, LOC105369535, LOC107984399, LOC649133, MCAM, MFRP, MIR4492, MIR6716, MIR6756, MPZL2, MPZL2, MPZL3, MPZL3, MPZL3, MPZL3, NECTIN1, NECTIN1, NECTIN1, NLRX1, NLRX1, NLRX1, NLRX1, OAF, PAFAH1B2, PAFAH1B2, PAFAH1B2, PAFAH1B2, PAFAH1B2, PAFAH1B2, PAFAH1B2, PAFAH1B2, PCSK7, PDZD3, PDZD3, PDZD3, PHLDB1, PHLDB1, PHLDB1, POU2F3, POU2F3, RNF214, RNF214, RNF214, RNF26, RPL23AP64, RPS25, SC5D, SC5D, SCN2B, SCN4B, SCN4B, SCN4B, SCN4B, SIDT2, SIK3, SIK3, SIK3, SIK3, SIK3, SLC37A4, SLC37A4, SLC37A4, SLC37A4, SLC37A4, SMIM35, SNORD150, SORL1, TAGLN, TAGLN, TBCEL, TBCEL, TBCEL, TBCEL-TECTA, TECTA, THY1, THY1, THY1, THY1, THY1, TLCD5, TLCD5, TLCD5, TLCD5, TLCD5, TLCD5, TLCD5, TMEM25, TMEM25, TMEM25, TMEM25, TMEM25, TMEM25, TMEM25, TMEM25, TMEM25, TMPRSS13, TMPRSS13, TMPRSS13, TMPRSS13, TMPRSS4, TMPRSS4, TMPRSS4, TMPRSS4, TMPRSS4, TMPRSS4, TMPRSS4, TRAPPC4, TRAPPC4, TRAPPC4, TRAPPC4, TRAPPC4, TRAPPC4, TRAPPC4, TREH, TREH, TRIM29, TRIM29, TTC36, TTC36, TTC36, TTC36, UBE4A, UBE4A, UPK2, USP2, USP2, USP2, USP2-AS1, VPS11, VPS11, VPS11, VPS11, VPS11, VPS11, VPS11, VPS11, VPS11, VPS11, VPS11, VPS11, VPS11, VPS11, ZPR1, ZPR1"
11,122646524,122968845,322.321,dup,"CRTAM, CRTAM, JHY, JHY, JHY, JHY, JHY, UBASH3B, UBASH3B"
11,123464341,126319192,2854.851,dup,"ACRV1, ACRV1, ACRV1, ACRV1, CCDC15, CDON, CDON, CDON, CHEK1, CHEK1, CHEK1, CHEK1, CHEK1, CHEK1, CHEK1, CHEK1, DCPS, DCPS, DDX25, DDX25, EI24, EI24, EI24, EI24, EI24, ESAM, FAM118B, FAM118B, FEZ1, FEZ1, FOXRED1, FOXRED1, FOXRED1, GRAMD1B, GRAMD1B, GRAMD1B, GRAMD1B, GRAMD1B, GRAMD1B, GRAMD1B, GRAMD1B, HEPACAM, HEPN1, HYLS1, HYLS1, HYLS1, HYLS1, LOC100507283, LOC101929340, LOC101929340, LOC403312, LOC403312, MSANTD2, MSANTD2, MSANTD2, MSANTD2, MSANTD2, MSANTD2, MSANTD2, NRGN, NRGN, OR10D3, OR10G4, OR10G6, OR10G7, OR10G8, OR10G9, OR10S1, OR4D5, OR6M1, OR6T1, OR6X1, OR8A1, OR8B12, OR8B2, OR8B3, OR8B4, OR8B8, OR8D1, OR8D2, OR8D4, OR8G1, OR8G1, OR8G2P, OR8G5, PANX3, PATE1, PATE2, PATE3, PATE4, PKNOX2, PKNOX2, PKNOX2, PKNOX2, PKNOX2, PKNOX2, PKNOX2, PKNOX2, PKNOX2, PKNOX2, PKNOX2, PKNOX2, PKNOX2, PKNOX2, PKNOX2, PKNOX2, PKNOX2, PKNOX2, PKNOX2, PKNOX2, PKNOX2, PKNOX2, PKNOX2, PKNOX2, PKNOX2, PKNOX2, PKNOX2, PKNOX2, PKNOX2-AS1, PUS3, PUS3, ROBO3, ROBO3, ROBO3, ROBO3, ROBO3, ROBO3, ROBO3, ROBO3, ROBO3, ROBO3, ROBO3, ROBO3, ROBO3, ROBO3, ROBO3, ROBO4, ROBO4, RPUSD4, RPUSD4, RPUSD4, SCN3B, SCN3B, SIAE, SIAE, SLC37A2, SLC37A2, SPA17, SRPRA, SRPRA, STT3A, STT3A, STT3A, STT3A-AS1, TBRG1, TBRG1, TIRAP, TIRAP, TIRAP, TIRAP, TMEM218, TMEM218, TMEM218, TMEM218, TMEM218, TMEM218, TMEM218, TMEM218, TMEM218, TMEM218, TMEM218, TMEM218, TMEM218, TMEM218, TMEM218, TMEM218, TMEM218, TMEM218, TMEM225, TMEM225, VSIG10L2, VSIG2, VSIG2, VWA5A, VWA5A, VWA5A, ZNF202, ZNF202, ZNF202, ZNF202"
11,128637509,128868739,231.23,dup,"FLI1, FLI1, FLI1, FLI1, KCNJ1, KCNJ1, KCNJ1, KCNJ1, KCNJ1, LOC101929538, SENCR"
11,129721592,130344213,622.621,dup,"APLP2, APLP2, APLP2, APLP2, APLP2, APLP2, APLP2, APLP2, APLP2, APLP2, APLP2, APLP2, APLP2, APLP2, APLP2, APLP2, APLP2, APLP2, APLP2, APLP2, APLP2, APLP2, APLP2, APLP2, APLP2, APLP2, APLP2, APLP2, APLP2, APLP2, APLP2, APLP2, APLP2, APLP2, APLP2, APLP2, APLP2, APLP2, APLP2, LINC00167, NFRKB, NFRKB, PRDM10, PRDM10, PRDM10, PRDM10, PRDM10, PRDM10, PRDM10, PRDM10, PRDM10, PRDM10, PRDM10, PRDM10, PRDM10, PRDM10, ST14, TMEM45B, TMEM45B, TMEM45B, TMEM45B, ZBTB44, ZBTB44, ZBTB44, ZBTB44, ZBTB44, ZBTB44, ZBTB44, ZBTB44, ZBTB44, ZBTB44, ZBTB44-DT"
11,133992859,134258123,265.264,dup,"ACAD8, JAM3, JAM3, LINC02731, NCAPD3, NCAPD3, NCAPD3, NCAPD3, NCAPD3, SNORD153, THYN1, THYN1, THYN1, THYN1, THYN1, VPS26B"
12,247247,1043041,795.794,dup,"B4GALNT3, CCDC77, CCDC77, CCDC77, CCDC77, ERC1, ERC1, ERC1, ERC1, ERC1, ERC1, KDM5A, LOC102723544, LOC105369595, NINJ2, NINJ2, NINJ2, NINJ2, NINJ2, NINJ2-AS1, RAD52, RAD52, RAD52, RAD52, RAD52, RAD52, SLC6A13, SLC6A13, SLC6A13, WNK1, WNK1, WNK1, WNK1"
12,1862861,2078075,215.214,dup,"CACNA1C, CACNA1C, CACNA1C, CACNA1C, CACNA1C, CACNA1C, CACNA1C, CACNA1C, CACNA1C, CACNA1C, CACNA1C, CACNA1C, CACNA1C, CACNA1C, CACNA1C, CACNA1C, CACNA1C, CACNA1C, CACNA1C, CACNA1C, CACNA1C, CACNA1C, CACNA1C, CACNA1C-IT2, CACNA2D4, DCP1B, DCP1B, DCP1B, LINC00940"
12,2566564,5023017,2456.453,dup,"AKAP3, AKAP3, C12orf4, C12orf4, C12orf4, C12orf4, C12orf4, C12orf4, C12orf4, C12orf4, C12orf4, C12orf4, CACNA1C, CACNA1C, CACNA1C, CACNA1C, CACNA1C, CACNA1C, CACNA1C, CACNA1C, CACNA1C, CACNA1C, CACNA1C, CACNA1C, CACNA1C, CACNA1C, CACNA1C, CACNA1C, CACNA1C, CACNA1C, CACNA1C, CACNA1C, CACNA1C, CACNA1C, CACNA1C, CACNA1C-AS1, CACNA1C-AS2, CCND2, CCND2-AS1, CCND2-AS1, CCND2-AS1, CRACR2A, CRACR2A, DYRK4, DYRK4, DYRK4, DYRK4, DYRK4, FGF23, FGF6, FKBP4, FOXM1, FOXM1, FOXM1, FOXM1, FOXM1, GALNT8, GAU1, ITFG2, ITFG2, ITFG2, ITFG2-AS1, ITFG2-AS1, KCNA1, KCNA6, LINC02417, LOC100128253, NDUFA9, NRIP2, PARP11, PARP11, PARP11, PARP11, PRMT8, PRMT8, RAD51AP1, RAD51AP1, RHNO1, RHNO1, RHNO1, RHNO1, RHNO1, RHNO1, RHNO1, TEAD4, TEAD4, TEAD4, TEX52, TEX52, TEX52, THCAT155, TIGAR, TSPAN9, TSPAN9, TULP3, TULP3"
12,6055049,9361351,3306.302,dup,"A2M, A2M, A2M, A2M, A2M-AS1, A2M-AS1, A2M-AS1, A2ML1, A2ML1, A2MP1, ACRBP, ACSM4, AICDA, AICDA, APOBEC1, APOBEC1, APOBEC1, ATN1, ATN1, C12orf57, C12orf57, C12orf57, C12orf57, C12orf57, C12orf57, C1R, C1R, C1RL, C1RL, C1RL, C1RL, C1RL-AS1, C1S, C1S, C1S, C3AR1, C3AR1, C3AR1, CD163, CD163, CD163, CD163, CD163, CD163L1, CD163L1, CD27, CD27-AS1, CD4, CD4, CD4, CD4, CD4, CD4, CD4, CD4, CD4, CD9, CD9, CDCA3, CDCA3, CDCA3, CDCA3, CDCA3, CDCA3, CDCA3, CHD4, CHD4, CHD4, CLEC4A, CLEC4A, CLEC4A, CLEC4A, CLEC4C, CLEC4C, CLEC4C, CLEC4C, CLEC4D, CLEC4E, CLEC6A, CLEC6A, CLSTN3, COPS7A, COPS7A, COPS7A, COPS7A, DPPA3, DSTNP2, EMG1, EMG1, EMG1, ENO2, FAM66C, FAM86FP, FAM90A1, FAM90A1, FOXJ2, GAPDH, GAPDH, GAPDH, GAPDH, GAPDH, GAPDH, GDF3, GNB3, GNB3, GPR162, GPR162, IFFO1, IFFO1, IFFO1, IFFO1, IFFO1, IFFO1, ING4, ING4, ING4, ING4, ING4, ING4, KLRG1, KLRG1, KLRG1, KLRG1, KLRG1, KLRG1, KLRG1, KLRG1, LAG3, LINC00612, LINC00937, LINC00987, LINC00987, LINC00987, LINC00987, LINC00987, LINC00987, LINC00987, LINC00987, LINC00987, LINC02449, LINC02449, LOC105369632, LOC642846, LPAR5, LPAR5, LPCAT3, LRRC23, LRRC23, LRRC23, LTBR, LTBR, M6PR, M6PR, MFAP5, MFAP5, MFAP5, MFAP5, MFAP5, MFAP5, MFAP5, MIR1244-1, MIR1244-2, MIR1244-3, MIR1244-4, MIR141, MIR200C, MIR200CHG, MLF2, MLF2, MLF2, MRPL51, NANOG, NANOG, NANOGNB, NCAPD2, NECAP1, NECAP1, NOP2, NOP2, NOP2, NOP2, NOP2, P3H3, PEX5, PEX5, PEX5, PEX5, PEX5, PEX5, PEX5, PEX5, PEX5, PEX5, PEX5, PEX5, PEX5, PEX5, PEX5, PEX5, PEX5, PEX5, PEX5, PEX5, PEX5, PEX5, PEX5, PEX5, PEX5, PEX5, PHB2, PHB2, PHC1, PIANP, PIANP, PIANP, PLEKHG6, PLEKHG6, PLEKHG6, PLEKHG6, PLEKHG6, PLEKHG6, PLEKHG6, PLEKHG6, PLEKHG6, PLEKHG6, PLEKHG6, PLEKHG6, POU5F1P3, PTMS, PTMS, PTPN6, PTPN6, PTPN6, PZP, RBP5, RBP5, RIMKLB, RIMKLB, RIMKLB, RIMKLB, RIMKLB, RIMKLB, RIMKLB, RIMKLB, RIMKLB, RIMKLB, RIMKLB, RIMKLB, RIMKLB, RIMKLB, RNU7-1, RPL13P5, SCARNA10, SCARNA11, SCARNA12, SCNN1A, SCNN1A, SCNN1A, SLC2A14, SLC2A14, SLC2A14, SLC2A14, SLC2A14, SLC2A14, SLC2A3, SPSB2, SPSB2, SPSB2, TAPBPL, TAPBPL, TAPBPL, TAPBPL, TAPBPL, TAPBPL, TNFRSF1A, TNFRSF1A, TNFRSF1A, TNFRSF1A, TPI1, TPI1, TPI1, USP5, USP5, USP5, USP5, USP5, USP5, USP5, USP5, USP5, USP5, USP5, USP5, USP5, USP5, USP5, VAMP1, VAMP1, VAMP1, VAMP1, VAMP1, VWF, ZNF384, ZNF384, ZNF384, ZNF705A"
12,9747738,13257243,3509.505,dup,"APOLD1, APOLD1, BCL2L14, BCL2L14, BCL2L14, BCL2L14, BCL2L14, BORCS5, BORCS5, BORCS5, CD69, CDKN1B, CLEC12A, CLEC12A, CLEC12A, CLEC12A, CLEC12A-AS1, CLEC12B, CLEC12B, CLEC12B, CLEC12B, CLEC12B, CLEC1A, CLEC1A, CLEC1A, CLEC1A, CLEC1A, CLEC1B, CLEC1B, CLEC2A, CLEC2A, CLEC2B, CLEC7A, CLEC7A, CLEC7A, CLEC7A, CLEC7A, CLEC7A, CLEC7A, CLEC9A, CREBL2, DDX47, DDX47, DUSP16, EIF2S3B, EIF2S3B, EMP1, ETV6, FAM234B, GABARAPL1, GABARAPL1, GPR19, GPRC5A, GPRC5D, GPRC5D-AS1, GPRC5D-AS1, GPRC5D-AS1, GPRC5D-AS1, GPRC5D-AS1, GPRC5D-AS1, GPRC5D-AS1, GSG1, GSG1, GSG1, GSG1, GSG1, GSG1, GSG1, GSG1, GSG1, GSG1, GSG1, GSG1, GSG1, GSG1, GSG1, GSG1, GSG1, HEBP1, HTR7P1, KLRA1P, KLRC1, KLRC1, KLRC1, KLRC1, KLRC1, KLRC2, KLRC3, KLRC3, KLRC4, KLRC4-KLRK1, KLRD1, KLRD1, KLRD1, KLRD1, KLRD1, KLRD1, KLRD1, KLRD1, KLRD1, KLRF1, KLRF1, KLRF1, KLRF1, KLRF1, KLRF1, KLRF1, KLRF1, KLRF2, KLRK1, KLRK1-AS1, LINC01252, LINC02366, LINC02446, LINC02446, LINC02470, LINC02617, LOC102724020, LOC102724020, LOC440084, LOH12CR2, LRP6, MAGOHB, MAGOHB, MAGOHB, MAGOHB, MAGOHB, MANSC1, MANSC1, MIR1244-1, MIR1244-2, MIR1244-3, MIR1244-4, MIR613, MIR614, OLR1, OLR1, OLR1, PRB1, PRB1, PRB1, PRB2, PRB3, PRB4, PRB4, PRH1, PRH1, PRH1, PRH1-PRR4, PRH1-TAS2R14, PRH2, PRR4, PRR4, RPL13AP20, SMIM10L1, STYK1, TAS2R10, TAS2R13, TAS2R14, TAS2R19, TAS2R20, TAS2R30, TAS2R31, TAS2R42, TAS2R43, TAS2R46, TAS2R50, TAS2R7, TAS2R8, TAS2R9, TMEM52B, TMEM52B, TMEM52B, TMEM52B, TMEM52B, TMEM52B, TMEM52B, YBX3, YBX3"
12,14576562,15104088,527.526,dup,"ARHGDIB, ARHGDIB, ARHGDIB, ARHGDIB, ARHGDIB, ARHGDIB, ART4, ART4, C12orf60, ERP27, ERP27, GUCY2C, H2AJ, H2AJ, H4-16, LINC01489, MGP, MGP, PDE6H, PLBD1-AS1, SMCO3, WBP11"
12,15636621,15836820,200.199,dup,EPS8
12,20765745,22090067,1324.322,dup,"ABCC9, ABCC9, ABCC9, ABCC9, CMAS, CMAS, GOLT1B, GYS2, IAPP, IAPP, KCNJ8, LDHB, LDHB, LDHB, PYROXD1, PYROXD1, PYROXD1, RECQL, RECQL, SLCO1A2, SLCO1A2, SLCO1B1, SLCO1B3, SLCO1B3, SLCO1B3-SLCO1B7, SLCO1B7, SPX, SPX, SPX"
12,25231206,25381355,150.149,dup,"KRAS, KRAS, KRAS, KRAS"
12,26539513,27951923,1412.41,dup,"ARNTL2, ARNTL2, ARNTL2, ARNTL2, ARNTL2, ARNTL2-AS1, C12orf71, C12orf71, FGFR1OP2, FGFR1OP2, FGFR1OP2, INTS13, ITPR2, KLHL42, MANSC4, MED21, MED21, MED21, MED21, MRPS35, MRPS35, PPFIBP1, PPFIBP1, PPFIBP1, PPFIBP1, REP15, SMCO2, STK38L, TM7SF3"
12,29445416,29674644,229.228,dup,"OVCH1, OVCH1-AS1, OVCH1-AS1, OVCH1-AS1, TMTC1, TMTC1, TMTC1"
12,30782752,32146113,1363.361,dup,"AMN1, AMN1, AMN1, AMN1, AMN1, BICD1, BICD1, BICD1, BICD1, BICD1, BICD1, BICD1, BICD1, DDX11, DDX11, DDX11, DDX11, DDX11, DDX11-AS1, DENND5B, DENND5B, DENND5B, DENND5B, DENND5B, DENND5B, DENND5B-AS1, ETFBKMT, ETFBKMT, ETFBKMT, FLJ13224, H3-5, LINC00941, LINC02387, LINC02422, OVOS2, RESF1, SINHCAF, SINHCAF, SINHCAF, TSPAN11, TSPAN11, TSPAN11"
12,32734702,33032999,298.297,dup,"DNM1L, DNM1L, DNM1L, DNM1L, DNM1L, DNM1L, DNM1L, DNM1L, PKP2, PKP2, YARS2"
12,39694655,39764724,70.069,dup,"C12orf40, C12orf40, SLC2A13"
12,40618578,40761720,143.142,dup,"CNTN1, CNTN1"
12,42680638,42866823,186.185,dup,"LINC02450, LINC02451, LINC02451"
12,46204158,46358311,154.153,dup,"SLC38A1, SLC38A1, SLC38A1, SLC38A1, SLC38A1, SLC38A1, SLC38A2, SLC38A2"
