chromosome,st_bp,end_bp,length_kb,cnv_type,overlapping_genes
8,101734633,103220116,1485.483,del,"ATP6V1C1, AZIN1, AZIN1, AZIN1, AZIN1, AZIN1, AZIN1, AZIN1, AZIN1, AZIN1, AZIN1, BAALC, BAALC, BAALC, BAALC-AS1, BAALC-AS2, GASAL1, KLF10, KLF10, KLF10, KLF10, LINC01181, LOC101927245, LOC101927245, LOC104054148, LOC105375683, MAILR, MAILR, MIR3151, MIR5680, NCALD, NCALD, NCALD, NCALD, NCALD, NCALD, NCALD, NCALD, ODF1, RRM2B, RRM2B, RRM2B, UBR5, UBR5, UBR5-AS1"
8,104455351,105360254,904.903,del,"DPYS, LRP12, LRP12, MIR548A3, ZFPM2, ZFPM2, ZFPM2"
8,105521416,110254143,4732.727,del,"ABRA, ANGPT1, ANGPT1, ANGPT1, EBAG9, EBAG9, EBAG9, EIF3E, EMC2, EMC2, EMC2, EMC2, EMC2, ENY2, ENY2, ENY2, ENY2, KCNV1, LOC100132813, NUDCD1, NUDCD1, OXR1, OXR1, OXR1, OXR1, OXR1, OXR1, PKHD1L1, RSPO2, RSPO2, RSPO2, SYBU, SYBU, SYBU, SYBU, SYBU, SYBU, SYBU, SYBU, SYBU, SYBU, SYBU, SYBU, SYBU, SYBU, SYBU, SYBU, SYBU, TMEM74, TMEM74, TRHR, ZFPM2, ZFPM2, ZFPM2, ZFPM2-AS1, ZFPM2-AS1"
8,110592482,120428307,9835.825,del,"AARD, CCN3, COL14A1, COL14A1, COLEC10, COLEC10, CSMD3, CSMD3, CSMD3, CSMD3, DEPTOR, DEPTOR, DSCC1, EIF3H, ENPP2, ENPP2, ENPP2, ENPP2, ENPP2, EXT1, LINC00536, LINC01608, LINC01608, LINC01609, LINC02237, LOC101927513, LOC105375713, MAL2, MAL2-AS1, MAL2-AS1, MAL2-AS1, MAL2-AS1, MED30, MED30, MED30, MIR2053, MIR3610, MIR548AZ, MRPL13, RAD21, RAD21-AS1, SAMD12, SAMD12, SAMD12, SAMD12, SAMD12, SAMD12, SAMD12-AS1, SLC30A8, SLC30A8, SLC30A8, SLC30A8, SLC30A8, SNORD168, TAF2, TNFRSF11B, TRPS1, TRPS1, TRPS1, TRPS1, UTP23"
8,121561440,123962838,2401.398,del,"ANXA13, ANXA13, ATAD2, C8orf76, DERL1, DERL1, DERL1, DERL1, FAM83A, FAM83A, FAM83A, FAM83A, FAM83A-AS1, FAM91A1, FAM91A1, FAM91A1, FBXO32, FBXO32, FBXO32, FER1L6, HAS2, HAS2-AS1, KLHL38, LINC01151, MIR4663, MIR548AA1, MIR548D1, NTAQ1, NTAQ1, NTAQ1, NTAQ1, SMILR, TBC1D31, TBC1D31, TBC1D31, TBC1D31, TBC1D31, TBC1D31, TBC1D31, TBC1D31, TBC1D31, TBC1D31, TBC1D31, TBC1D31, ZHX1, ZHX1, ZHX1, ZHX1, ZHX1-C8orf76, ZHX2, ZHX2"
8,126114989,130759628,4644.639,del,"ASAP1, ASAP1, ASAP1, ASAP1, ASAP1, ASAP1-IT1, ASAP1-IT2, CASC11, CASC11, CASC19, CASC21, CASC8, CASC8, CCAT1, CCAT2, CCDC26, CCDC26, CCDC26, CCDC26, CYRIB, CYRIB, CYRIB, CYRIB, CYRIB, CYRIB, CYRIB, CYRIB, CYRIB, CYRIB, CYRIB, CYRIB, CYRIB, CYRIB, CYRIB, CYRIB, CYRIB, CYRIB, CYRIB, CYRIB, CYRIB, CYRIB, CYRIB, CYRIB, CYRIB, CYRIB, CYRIB, CYRIB, CYRIB, CYRIB, CYRIB, CYRIB, CYRIB, CYRIB, CYRIB, CYRIB, CYRIB, CYRIB, CYRIB, CYRIB, CYRIB, CYRIB, CYRIB, CYRIB, CYRIB, CYRIB, CYRIB, CYRIB, CYRIB, CYRIB, CYRIB, CYRIB, CYRIB, CYRIB, CYRIB, CYRIB, CYRIB, CYRIB, CYRIB, CYRIB, CYRIB, CYRIB, CYRIB, CYRIB, CYRIB, CYRIB, CYRIB, CYRIB, CYRIB, CYRIB, CYRIB, CYRIB, CYRIB, CYRIB, CYRIB, CYRIB, CYRIB, CYRIB, GSDMC, LINC00824, LINC00824, LINC00976, LINC00977, LOC101927657, LRATD2, LRATD2, MIR1204, MIR1205, MIR1206, MIR1207, MIR1208, MIR3686, MIR5194, MYC, MYC, PCAT1, PCAT2, POU5F1B, PRNCR1, PVT1, TMEM75"
8,131201070,133621487,2420.417,del,"CCN4, CCN4, CCN4, CCN4, CCN4, EFR3A, EFR3A, EFR3A, EFR3A, EFR3A, EFR3A, EFR3A, EFR3A, EFR3A, HHLA1, HPYR1, KCNQ3, KCNQ3, LRRC6, LRRC6, LRRC6, LRRC6, LRRC6, LRRC6, LRRC6, LRRC6, LRRC6, LRRC6, LRRC6, LRRC6, LRRC6, LRRC6, LRRC6, LRRC6, LRRC6, MIR7848, NDRG1, NDRG1, NDRG1, NDRG1, NDRG1, NDRG1, NDRG1, NDRG1, OC90, PHF20L1, PHF20L1, PHF20L1, PHF20L1, PHF20L1, PTCSC1, SLA, SLA, SLA, SLA, SLA, ST3GAL1, ST3GAL1, TG, TMEM71, TMEM71, TMEM71, TMEM71, TMEM71, TMEM71, TMEM71, TMEM71, TMEM71, TMEM71, TMEM71, TMEM71, TMEM71"
8,134488354,139601461,5113.107,del,"COL22A1, FAM135B, FAM135B, KCNK9, KHDRBS3, LINC01591, LINC01591, LINC01591, LINC02055, LOC101927845, LOC101927915, LOC401478, MIR30B, MIR30D, NCRNA00250, ZFAT, ZFAT, ZFAT, ZFAT, ZFAT, ZFAT, ZFAT, ZFAT-AS1"
8,139856717,141523381,1666.664,del,"AGO2, AGO2, CHRAC1, CHRAC1, CHRAC1, DENND3, DENND3, DENND3, DENND3, DENND3, GPR20, LINC01300, LOC105375787, MIR151A, MROH5, MROH5, MROH5, MROH5, PEG13, PTK2, PTK2, PTK2, PTK2, PTK2, PTK2, PTK2, PTK2, PTK2, PTK2, PTK2, PTK2, PTK2, PTK2, PTK2, PTK2, PTK2, PTK2, PTK2, PTK2, PTK2, PTK2, PTK2, PTK2, PTK2, PTK2, PTK2, PTK2, PTK2, PTK2, PTK2, PTK2, PTK2, PTK2, PTK2, PTK2, PTK2, PTK2, PTK2, PTK2, PTK2, PTK2, PTK2, PTK2, PTK2, PTK2, PTK2, PTK2, PTK2, PTK2, PTK2, PTK2, PTK2, PTK2, PTK2, PTK2, PTK2, PTK2, PTK2, PTK2, PTK2, PTK2, PTK2, PTK2, PTK2, PTK2, PTK2, PTP4A3, PTP4A3, SLC45A4, SLC45A4, SLC45A4, TRAPPC9, TRAPPC9, TRAPPC9, TRAPPC9, TRAPPC9, TRAPPC9, TRAPPC9"
8,142507365,143821677,1314.312,del,"ADGRB1, ARC, C8orf31, C8orf31, C8orf31, CCDC166, CDC42P3, CYP11B1, CYP11B1, CYP11B2, EEF1D, EEF1D, EEF1D, EEF1D, EEF1D, EEF1D, EEF1D, EEF1D, EEF1D, EEF1D, FAM83H, GFUS, GFUS, GLI4, GML, GPIHBP1, GPIHBP1, GSDMD, GSDMD, IQANK1, IQANK1, JRK, JRK, JRK, LINC02878, LNCOC1, LOC100310756, LOC101928087, LOC101928160, LOC105375800, LY6D, LY6E, LY6E, LY6E-DT, LY6H, LY6H, LY6H, LY6K, LY6K, LY6K, LY6L, LYNX1, LYNX1, LYNX1, LYNX1, LYNX1-SLURP2, LYPD2, MAFA, MAFA-AS1, MAPK15, MINCR, MINCR, MIR1302-7, MIR4664, MIR937, MROH6, NAPRT, NAPRT, NAPRT, NAPRT, PSCA, PSCA, PUF60, PUF60, PUF60, PUF60, PUF60, PUF60, PUF60, PUF60, PUF60, PUF60, PUF60, PYCR3, PYCR3, PYCR3, RHPN1, RHPN1-AS1, SCRIB, SCRIB, SLURP1, SLURP2, SLURP2, SNORD149, THEM6, THEM6, THEM6, TIGD5, TOP1MT, TOP1MT, TOP1MT, ZC3H3, ZFP41, ZFP41, ZNF623, ZNF623, ZNF623, ZNF696, ZNF707, ZNF707, ZNF707, ZNF707, ZNF707, ZNF707, ZNF707, ZNF707, ZNF707, ZNF707, ZNF707, ZNF707"
8,145163018,145532386,369.368,del,
9,745745,2032029,1286.284,del,"DMRT1, DMRT1, DMRT2, DMRT2, DMRT2, DMRT2, DMRT2, DMRT2, DMRT2, DMRT3, KANK1, KANK1, KANK1, KANK1, KANK1, KANK1, KANK1, KANK1, KANK1, KANK1, KANK1, KANK1, KANK1, KANK1, KANK1, KANK1, KANK1, KANK1, KANK1, LINC01230, SMARCA2, SMARCA2, SMARCA2, SMARCA2"
9,2193191,2634631,441.44,del,"SMARCA2, SMARCA2, SMARCA2, SMARCA2, SMARCA2, SMARCA2, SMARCA2, VLDLR, VLDLR, VLDLR, VLDLR, VLDLR-AS1"
9,2876874,4543538,1666.664,del,"GLIS3, GLIS3, GLIS3-AS1, LINC01231, RFX3, RFX3, RFX3, RFX3, RFX3, RFX3-AS1, SLC1A1"
9,6849843,8317308,1467.465,del,"DMAC1, DMAC1, DMAC1, KDM4C, KDM4C, KDM4C, KDM4C, KDM4C, KDM4C, KDM4C, KDM4C, KDM4C, KDM4C, KDM4C, KDM4C, KDM4C, KDM4C, KDM4C, PTPRD, PTPRD, PTPRD, PTPRD, PTPRD, PTPRD, PTPRD, PTPRD, PTPRD, PTPRD"
9,8529521,14719704,6190.183,del,"LINC00583, LINC01235, LOC105375972, LURAP1L, LURAP1L-AS1, MPDZ, MPDZ, MPDZ, MPDZ, MPDZ, MPDZ, MPDZ, MPDZ, MPDZ, MPDZ, MPDZ, MPDZ, MPDZ, MPDZ, MPDZ, MPDZ, MPDZ, MPDZ, NFIB, NFIB, NFIB, NFIB, NFIB, NFIB, NFIB, NFIB, NFIB, NFIB, NFIB, NFIB, NFIB, NFIB, NFIB, NFIB, NFIB, NFIB, NFIB, NFIB, NFIB, NFIB, NFIB, NFIB, NFIB, NFIB, NFIB, NFIB, NFIB, NFIB, NFIB, NFIB, PTPRD, PTPRD, PTPRD, PTPRD, PTPRD, PTPRD, PTPRD, PTPRD, PTPRD, PTPRD, PTPRD-AS1, PTPRD-AS1, PTPRD-AS2, SNORD137, TYRP1, ZDHHC21, ZDHHC21, ZDHHC21, ZDHHC21, ZDHHC21, ZDHHC21, ZDHHC21, ZDHHC21, ZDHHC21, ZDHHC21, ZDHHC21, ZDHHC21, ZDHHC21, ZDHHC21, ZDHHC21, ZDHHC21, ZDHHC21, ZDHHC21, ZDHHC21"
9,15746731,18927908,3181.177,del,"ADAMTSL1, ADAMTSL1, BNC2, BNC2, BNC2, BNC2-AS1, C9orf92, CCDC171, CCDC171, CCDC171, CNTLN, CNTLN, CNTLN, CNTLN, CNTLN, MIR3152, SAXO1, SAXO1, SAXO1, SH3GL2"
9,19521502,20714693,1193.191,del,"FOCAD, FOCAD, FOCAD, FOCAD, FOCAD-AS1, MIR4473, MIR4474, MLLT3, MLLT3, SLC24A2, SLC24A2, SLC24A2, SLC24A2"
9,21482461,26841814,5359.353,del,"CAAP1, CAAP1, CDKN2A, CDKN2A, CDKN2A, CDKN2A, CDKN2A, CDKN2A-DT, CDKN2B, CDKN2B, CDKN2B-AS1, CDKN2B-AS1, CDKN2B-AS1, CDKN2B-AS1, CDKN2B-AS1, CDKN2B-AS1, CDKN2B-AS1, CDKN2B-AS1, CDKN2B-AS1, CDKN2B-AS1, CDKN2B-AS1, CDKN2B-AS1, CDKN2B-AS1, CDKN2B-AS1, DMRTA1, ELAVL2, ELAVL2, ELAVL2, ELAVL2, ELAVL2, ELAVL2, ELAVL2, ELAVL2, ELAVL2, ELAVL2, ELAVL2, ELAVL2, ELAVL2, ELAVL2, ELAVL2, ELAVL2, ELAVL2, ELAVL2, ELAVL2, ELAVL2, ELAVL2, ELAVL2, ELAVL2, ELAVL2, ELAVL2, ELAVL2, ELAVL2, ELAVL2, ELAVL2, ELAVL2, ELAVL2, ELAVL2, ELAVL2, ELAVL2, ELAVL2, ELAVL2, ELAVL2, ELAVL2, ELAVL2, ELAVL2, ELAVL2, IZUMO3, IZUMO3, LINC01239, LINC01241, LOC100506422, LOC101929563, MIR31, MIR31HG, MIR31HG, MIR31HG, MIR31HG, MTAP, TUSC1"
9,27611584,32405372,4793.788,del,"ACO1, ACO1, ACO1, LINC01242, LINC01243, LINGO2, LINGO2, LINGO2, LINGO2, MIR873, MIR876"
9,37888851,71394322,33505.471,del,"ALDH1B1, ANKRD18A, ANKRD18A, ANKRD20A1, ANKRD20A4-ANKRD20A20P, APBA1, AQP7P1, AQP7P3, AQP7P3, AQP7P3, BANCR, C9orf135, C9orf135, C9orf135, C9orf135, C9orf135, C9orf135, C9orf135-DT, CBWD3, CBWD3, CBWD3, CBWD3, CBWD3, CBWD3, CBWD3, CBWD3, CBWD5, CBWD5, CBWD5, CBWD5, CBWD5, CBWD5, CBWD5, CBWD5, CBWD6, CNTNAP3, CNTNAP3B, CNTNAP3P2, FAM122A, FAM189A2, FAM189A2, FAM189A2, FAM201A, FAM242F, FAM27B, FAM27C, FAM27E2, FAM27E3, FAM74A1, FAM74A1, FAM74A1, FAM74A3, FAM74A4, FAM74A4, FAM74A6, FAM74A6, FAM74A7, FAM95B1, FAM95B1, FAM95B1, FAM95C, FGF7P3, FGF7P6, FGF7P6, FLJ43315, FOXD4L3, FOXD4L4, FOXD4L5, FOXD4L6, FRG1HP, FRG1HP, FRG1JP, FXN, FXN, GLIDR, GLIDR, GLIDR, GLIDR, GXYLT1P3, GXYLT1P3, IGFBPL1, KLF9, LERFS, LERFS, LINC00537, LINC00537, LINC01189, LINC01410, LINC01506, LOC100132249, LOC100996643, LOC100996643, LOC100996643, LOC100996643, LOC100996643, LOC100996643, LOC101927069, LOC101927827, LOC101928195, LOC101928195, LOC101928195, LOC101928381, LOC101928381, LOC101928381, LOC101929583, LOC101929583, LOC101929583, LOC101929583, LOC101929583, LOC102723709, LOC102723709, LOC102724238, LOC102724238, LOC102724580, LOC102724904, LOC103908604, LOC103908605, LOC103908605, LOC105379252, LOC105379252, LOC105379252, LOC105379443, LOC105379443, LOC105379443, LOC105379443, LOC105379443, LOC105379443, LOC105379443, LOC105379450, LOC105379807, LOC105379807, LOC107984035, LOC286297, LOC286297, LOC440896, LOC440896, LOC440896, LOC554249, LOC554249, LOC642929, LOC728673, MAMDC2, MAMDC2, MAMDC2, MAMDC2-AS1, MIR1299, MIR204, MIR4477A, MIR4477A, MIR4477B, MIR4477B, PGM5, PGM5-AS1, PGM5-AS1, PGM5-AS1, PGM5P2, PIP5K1B, PIP5K1B, PIP5K1B, PIP5K1B, PIP5K1B, PIP5K1B, PIP5K1B, PRKACG, PTAR1, PTAR1, PTAR1, PTAR1, PTAR1, PTAR1, PTAR1, PTAR1, PTAR1, PTAR1, PTGER4P2-CDK2AP2P2, PTGER4P2-CDK2AP2P2, SHB, SLC25A51, SLC25A51, SLC25A51, SMC5, SMC5-AS1, SPATA31A1, SPATA31A3, SPATA31A5, SPATA31A5, SPATA31A6, SPATA31A7, SPATA31A7, TJP2, TJP2, TJP2, TJP2, TJP2, TJP2, TJP2, TJP2, TJP2, TJP2, TJP2, TMEM252, TRPM3, TRPM3, TRPM3, TRPM3, TRPM3, TRPM3, TRPM3, TRPM3, TRPM3, TRPM3, TRPM3, TRPM3, TRPM3, TRPM3, TRPM3, TRPM3, TRPM3, TRPM3, TRPM3, TRPM3, TRPM3, TRPM3, TRPM3, XLOC_007697, ZNF658, ZNF658, ZNF658, ZNF658B"
9,72092020,72722649,630.629,del,"GDA, GDA, GDA, GDA, GDA, GDA, GDA, GDA, LINC01504, LINC01504, TMC1, ZFAND5, ZFAND5, ZFAND5, ZFAND5, ZFAND5, ZFAND5"
9,73256183,74299224,1043.041,del,
9,74366292,77244166,2877.874,del,"C9orf40, CARNMT1, CARNMT1, CARNMT1, CARNMT1-AS1, FOXB2, GCNT1, GCNT1, GCNT1, GCNT1, GCNT1, LOC101927358, NMRK1, NMRK1, NMRK1, NMRK1, OSTF1, PCA3, PCA3, PCA3, PCSK5, PCSK5, PCSK5, PCSK5, PRUNE2, PRUNE2, PRUNE2, PRUNE2, PRUNE2, PRUNE2, PRUNE2, PRUNE2, RFK, RORB, RORB, RORB-AS1, RPSAP9, TRPM6, TRPM6, TRPM6, VPS13A, VPS13A, VPS13A, VPS13A, VPS13A-AS1"
9,77762685,78771692,1009.007,del,"CEP78, CEP78, CEP78, CEP78, CEP78, CEP78, CEP78, CEP78, GNAQ, PSAT1, PSAT1"
9,79329250,79814734,485.484,del,"TLE4, TLE4, TLE4, TLE4, TLE4, TLE4, TLE4, TLE4, TLE4, TLE4, TLE4, TLE4, TLE4, TLE4, TLE4, TLE4, TLE4, TLE4, TLE4"
9,80049970,84603518,4553.548,del,"C9orf64, C9orf64, FRMD3, FRMD3, FRMD3, FRMD3, FRMD3, FRMD3, GKAP1, GKAP1, HNRNPK, HNRNPK, HNRNPK, HNRNPK, HNRNPK, HNRNPK, IDNK, IDNK, IDNK, IDNK, IDNK, KIF27, KIF27, KIF27, KIF27, KIF27, KIF27, LOC101927502, LOC101927575, LOC105376114, LOC105376114, MIR7-1, RASEF, RMI1, RMI1, RMI1, RMI1, RMI1, SLC28A3, SLC28A3, SLC28A3, SPATA31D1, SPATA31D3, SPATA31D4, SPATA31D5P, TLE1, TLE1, TLE1, UBQLN1, UBQLN1"
9,84704620,86243156,1538.536,del,"AGTPBP1, AGTPBP1, AGTPBP1, AGTPBP1, C9orf153, C9orf153, C9orf153, GOLM1, GOLM1, LOC101927623, LOC389765, NAA35, NAA35, NAA35, NTRK2, NTRK2, NTRK2, NTRK2, NTRK2, NTRK2, NTRK2, NTRK2, NTRK2, NTRK2, NTRK2, NTRK2, NTRK2, NTRK2, NTRK2, NTRK2, NTRK2, NTRK2, NTRK2, NTRK2, NTRK2, NTRK2, NTRK2, NTRK2, NTRK2, NTRK2, NTRK2"
9,86618532,88190101,1571.569,del,"CDK20, CDK20, CDK20, CDK20, CDK20, CTSL, CTSL, CTSL, CTSL, CTSL, CTSL, CTSL, CTSL, CTSL, CTSL, CTSL3P, CTSLP8, DAPK1, DAPK1, DAPK1, DAPK1, DAPK1-IT1, GAS1, GAS1RR, LINC02872, LOC102724156, LOC102724156, LOC392364, LOC440173, LOC497256, NFYCP2, SPATA31C1, SPATA31C2, SPATA31C2, SPATA31E1"
9,88968880,90252161,1283.281,del,"C9orf47, C9orf47, CKS2, GADD45G, LOC101927847, MIR3153, MIR4290, MIR4290HG, S1PR3, SECISBP2, SECISBP2, SECISBP2, SECISBP2, SECISBP2, SECISBP2, SECISBP2, SECISBP2, SEMA4D, SEMA4D, SEMA4D, SEMA4D, SEMA4D, SEMA4D, SEMA4D, SEMA4D, SEMA4D, SEMA4D, SEMA4D, SEMA4D, SEMA4D, SEMA4D, SEMA4D, SEMA4D, SEMA4D, SHC3, UNQ6494"
9,90805715,91929837,1124.122,del,"AUH, AUH, AUH, AUH, AUH, LINC00484, LOC100129316, MIR3910-1, MIR3910-2, NFIL3, NFIL3, NFIL3, ROR2, ROR2, SYK, SYK, SYK, SYK"
9,92065974,94793698,2727.724,del,"ANKRD19P, AOPEP, AOPEP, AOPEP, ASPN, ASPN, BARX1, BARX1-DT, BICD2, BICD2, C9orf129, CARD19, CARD19, CARD19, CARD19, CARD19, CARD19, CARD19, CARD19, CARD19, CARD19, CARD19, CENPP, CENPP, CENPP, ECM2, ECM2, ECM2, FAM120A, FAM120A, FAM120A, FAM120A, FAM120AOS, FAM120AOS, FAM120AOS, FAM120AOS, FAM120AOS, FAM120AOS, FAM120AOS, FAM120AOS, FAM120AOS, FAM120AOS, FAM120AOS, FAM120AOS, FBP1, FBP1, FBP2, FGD3, FGD3, FGD3, FGD3, FGD3, IARS1, IARS1, IARS1, IARS1, IARS1, IARS1, IARS1, IARS1, IARS1, IARS1, IARS1, IARS1, IARS1, IARS1, IARS1, IARS1, IARS1, IARS1, IARS1, IARS1, IARS1, IARS1, IPPK, LINC00475, LINC02603, LINC02603, LINC02603, LOC100128076, LOC100128361, LOC100132077, LOC101927954, LOC101929748, LOC642943, MFSD14B, MIR3651, MIR4291, MIR4670, MIR548AU, MIRLET7A1, MIRLET7D, MIRLET7F1, NINJ1, NOL8, NOL8, NOL8, NOL8, NUTM2F, OGN, OGN, OGN, OMD, PCAT7, PCAT7, PCAT7, PCAT7, PHF2, PRSS47, PTPDC1, PTPDC1, PTPDC1, PTPDC1, SNORA84, SPTLC1, SPTLC1, SPTLC1, SPTLC1, SPTLC1, SUSD3, SUSD3, SUSD3, SUSD3, SUSD3, WNK2, WNK2, ZNF169, ZNF169, ZNF169, ZNF484, ZNF484, ZNF484, ZNF484, ZNF484, ZNF484, ZNF484"
9,96440344,98208109,1767.765,del,"ANKRD18CP, ANP32B, CCDC180, CCDC180, CDC14B, CDC14B, CDC14B, CDC14B, CDC14B, CDC14B, CDC14B, CDC14B, CORO2A, CORO2A, CTSV, CTSV, FOXE1, GAS2L1P2, HABP4, HEMGN, HEMGN, LOC100132781, LOC286359, LOC441455, MFSD14C, MFSD14C, MFSD14C, MIR1302-8, NANS, NCBP1, NCBP1, NCBP1, NCBP1, NCBP1, NUTM2G, NUTM2G, PRXL2C, PTCSC2, PTMAP11, SUGT1P4-STRA6LP, SUGT1P4-STRA6LP-CCDC180, SUGT1P4-STRA6LP-CCDC180, SUGT1P4-STRA6LP-CCDC180, TBC1D2, TBC1D2, TBC1D2, TBC1D2, TDRD7, TDRD7, TMOD1, TMOD1, TRIM14, TRIM14, TRMO, TRMO, TRMO, TRMO, TRMO, TRMO, TRMO, TSTD2, XPA, XPA, XPA, XPA, XPA, XPA, XPA, ZNF510, ZNF510, ZNF510, ZNF782, ZNF782, ZNF782, ZNF782"
9,98249151,98642543,393.392,del,"GABBR2, TBC1D2, TBC1D2, TBC1D2"
9,101993892,102588485,594.593,del,LINC00587
9,103349246,104070966,721.72,del,LOC101928523
9,104450346,107266158,2815.812,del,"ABCA1, FKTN, FKTN, FKTN, FKTN, FKTN, FKTN, FKTN, FKTN, FKTN, FKTN, FKTN, FKTN, FSD1L, FSD1L, FSD1L, FSD1L, FSD1L, LINC01505, LOC340512, MIR8081, NIPSNAP3A, NIPSNAP3A, NIPSNAP3B, NIPSNAP3B, NIPSNAP3B, OR13C2, OR13C3, OR13C4, OR13C5, OR13C8, OR13C9, OR13D1, OR13F1, RALGAPA1P1, SLC44A1, SLC44A1, SLC44A1, TAL2, TMEM38B, ZNF462, ZNF462"
9,107651544,108096988,445.444,del,
9,108523415,109684574,1161.159,del,"ABITRAM, ACTL7A, ACTL7B, CTNNAL1, CTNNAL1, ELP1, ELP1, ELP1, EPB41L4B, EPB41L4B, EPB41L4B, FRRS1L, MIR32, MIR3927, PALM2AKAP2, PTPN3, PTPN3, PTPN3, PTPN3, PTPN3, PTPN3, PTPN3, TMEM245"
9,109933824,111616504,1682.68,del,"C9orf152, ECPAS, ECPAS, ECPAS, ECPAS, LPAR1, LPAR1, LPAR1, LPAR1, LPAR1, LPAR1, LPAR1, LPAR1, LPAR1, LPAR1, LPAR1, LPAR1, LPAR1, LPAR1, LPAR1, LPAR1, LPAR1, LPAR1, LPAR1, LPAR1, LPAR1, LPAR1, LPAR1, LPAR1, LPAR1, LPAR1, LRRC37A5P, MIR7702, MUSK, MUSK, MUSK, MUSK, OR2K2, PALM2AKAP2, PALM2AKAP2, PALM2AKAP2, PALM2AKAP2, PALM2AKAP2, PALM2AKAP2, PALM2AKAP2, PTGR1, PTGR1, PTGR1, SVEP1, TXN, TXN, TXNDC8, TXNDC8, TXNDC8, TXNDC8, ZNF483, ZNF483"
9,112226114,112897784,671.67,del,"C9orf147, HSDL2, HSDL2, HSDL2, INIP, INIP, INIP, INIP, INIP, INIP, INIP, INIP, INIP, INIP, KIAA1958, KIAA1958, KIAA1958, PTBP3, PTBP3, PTBP3, PTBP3, PTBP3, PTBP3, PTBP3, PTBP3, SLC46A2, SNX30"
9,113563450,114088974,525.524,del,"AMBP, RGS3, RGS3, RGS3, RGS3, RGS3, RGS3, RGS3, RGS3, RGS3, RGS3, RGS3, ZNF618, ZNF618, ZNF618, ZNF618"
9,117853736,123151027,5297.291,del,"B3GNT10, BRINP1, C5, C5, C5, C5-OT1, CDK5RAP2, CDK5RAP2, CDK5RAP2, CDK5RAP2, CDK5RAP2, CDK5RAP2, CDK5RAP2, CDK5RAP2, CNTRL, CNTRL, CNTRL, CNTRL, CNTRL, CNTRL, CNTRL, CNTRL, CUTALP, CUTALP, CUTALP, CUTALP, DAB2IP, DAB2IP, FBXW2, FBXW2, FBXW2, FBXW2, GGTA1, GGTA1, GGTA1, GGTA1, GGTA1, GGTA1, GGTA1, GPR21, GSN, GSN, GSN, GSN, GSN, GSN, GSN, GSN, GSN, GSN, GSN, GSN, GSN, GSN, GSN, GSN, GSN, GSN, GSN, GSN, GSN, GSN, GSN, GSN, GSN, GSN, GSN, GSN, GSN, GSN, GSN, GSN, GSN, GSN, GSN, GSN, GSN-AS1, LHX6, LHX6, LHX6, LHX6, LHX6, LHX6, LINC01613, LINC02578, MEGF9, MIR147A, MIR4478, MIR600, MIR600HG, MORN5, MORN5, MRRF, MRRF, MRRF, MRRF, MRRF, MRRF, MRRF, MRRF, MRRF, NDUFA8, NDUFA8, OR1B1, OR1J1, OR1J2, OR1J4, OR1K1, OR1L1, OR1L3, OR1L4, OR1L6, OR1L8, OR1N1, OR1N2, OR1Q1, OR5C1, PDCL, PHF19, PHF19, PHF19, PHF19, PHF19, PHF19, PSMD5, PSMD5, PTGS1, PTGS1, PTGS1, PTGS1, PTGS1, PTGS1, PTGS1, RAB14, RABGAP1, RBM18, RBM18, RBM18, RC3H2, RC3H2, RC3H2, RC3H2, RC3H2, RC3H2, SNORD90, STOM, STOM, STOM, STOM, STOM, STRBP, STRBP, STRBP, STRBP, STRBP, STRBP, TRAF1, TRAF1, TRAF1, TTLL11, TTLL11, ZBTB26, ZBTB26, ZBTB26, ZBTB6"
9,124118995,124905780,786.785,del,"ARPC5L, GOLGA1, LOC100129034, LOC613206, MIR181A2, MIR181A2HG, MIR181B2, NEK6, NEK6, NEK6, NEK6, NEK6, NEK6, NEK6, NR5A1, NR6A1, NR6A1, NR6A1, OLFML2A, OLFML2A, PSMB7, RPL35, WDR38, WDR38, WDR38, WDR38"
9,126221095,127073946,852.851,del,"LMX1B, LMX1B, LMX1B, LOC101929116, MVB12B, MVB12B, NRON, RALGPS1, RALGPS1, RALGPS1, RALGPS1, RALGPS1, RALGPS1, RALGPS1, RALGPS1, RALGPS1, RALGPS1, RALGPS1, RALGPS1, RALGPS1, ZBTB34, ZBTB43, ZBTB43"
9,128125998,129594464,1468.466,del,"C9orf106, C9orf16, CERCAM, CERCAM, CIZ1, CIZ1, CIZ1, CIZ1, CIZ1, CIZ1, CIZ1, COQ4, COQ4, CRAT, CRAT, CRAT, CRAT, CRAT, CRAT, CRAT, DNM1, DNM1, DNM1, DNM1, DNM1, DNM1, DOLK, DOLPP1, DOLPP1, DOLPP1, DYNC2I2, ENDOG, GLE1, GLE1, GOLGA2, GOLGA2, GOLGA2, IER5L, KYAT1, KYAT1, KYAT1, KYAT1, KYAT1, KYAT1, KYAT1, KYAT1, KYAT1, KYAT1, KYAT1, KYAT1, KYAT1, KYAT1, KYAT1, KYAT1, KYAT1, KYAT1, KYAT1, LCN2, LINC00963, LINC01503, LINC01503, LOC100506100, LOC101929331, LRRC8A, LRRC8A, LRRC8A, MIGA2, MIGA2, MIGA2, MIGA2, MIGA2, MIGA2, MIGA2, MIR1268A, MIR199B, MIR219A2, MIR219B, MIR3154, NUP188, ODF2, ODF2, ODF2, ODF2, ODF2, ODF2, ODF2, ODF2, ODF2, ODF2, ODF2, ODF2, ODF2, ODF2, ODF2, ODF2, ODF2, ODF2, ODF2, ODF2, ODF2, ODF2, ODF2, PHYHD1, PHYHD1, PHYHD1, PKN3, PKN3, PTGES2, PTGES2, PTGES2, PTGES2-AS1, PTPA, PTPA, PTPA, PTPA, PTPA, PTPA, SET, SET, SET, SET, SET, SH3GLB2, SH3GLB2, SH3GLB2, SH3GLB2, SH3GLB2, SH3GLB2, SH3GLB2, SLC27A4, SPOUT1, SPTAN1, SPTAN1, SPTAN1, SPTAN1, SPTAN1, SPTAN1, SPTAN1, SPTAN1, SPTAN1, SPTAN1, SPTAN1, SWI5, SWI5, SWI5, SWI5, TBC1D13, TBC1D13, TRUB2, TRUB2, TRUB2, TRUB2, URM1, URM1, URM1, URM1, ZDHHC12, ZDHHC12, ZDHHC12, ZDHHC12, ZDHHC12, ZER1, ZER1, ZER1, ZER1, ZER1, ZER1, ZER1"
9,137810673,138376237,565.564,del,"CACNA1B, CACNA1B, EHMT1, EHMT1, FAM157B, LOC100133077, LOC101928786, LOC101928932, LOC105376331, LOC105376331, MIR602, TUBBP5"
10,469469,857856,388.387,del,"DIP2C, DIP2C-AS1, DIP2C-AS1, LARP4B, LARP4B, LOC101930421, MIR5699"
10,1176175,3141137,1964.962,del,"ADARB2, ADARB2-AS1, ADARB2-AS1, LINC00700, LINC00701, LINC02645, LOC101927824, LOC101927824, MIR6072, PFKP, PFKP, PFKP, PFKP, PFKP, PFKP, PFKP, PFKP, PFKP, PFKP, PFKP, PITRM1, PITRM1, PITRM1, PITRM1, PITRM1, PITRM1, PITRM1, PITRM1, PITRM1, PITRM1, PITRM1, PITRM1, PITRM1, SNORD142"
10,3213210,5004999,1791.789,del,"AKR1C1, AKR1C2, AKR1C2, AKR1C2, AKR1C2, AKR1C6P, AKR1E2, AKR1E2, AKR1E2, AKR1E2, AKR1E2, AKR1E2, KLF6, KLF6, KLF6, KLF6, LINC00702, LINC00703, LINC00703, LINC00703, LINC00705, LINC02639, LINC02669, LINC02669, LINC02669, LINC02669, LOC101927964, LOC105376353, LOC105376353, LOC105376360, MANCR, MIR6078"
10,6557551,7604596,1047.045,del,"ITIH5, ITIH5, ITIH5, LINC00706, LINC00707, LINC02648, LINP1, MIR4454, PRKCQ, PRKCQ, PRKCQ, PRKCQ, PRKCQ, PRKCQ, PRKCQ, PRKCQ-AS1, PRKCQ-AS1, SFMBT2, SFMBT2, SNORD129"
10,7866859,11961949,4095.09,del,"CELF2, CELF2, CELF2, CELF2, CELF2, CELF2, CELF2, CELF2, CELF2, CELF2, CELF2, CELF2, CELF2, CELF2, CELF2, CELF2, CELF2, CELF2, CELF2, CELF2, CELF2, CELF2, CELF2, CELF2, CELF2, CELF2, CELF2, CELF2, CELF2, CELF2, CELF2, CELF2, CELF2, CELF2, CELF2, CELF2, CELF2-AS1, CELF2-AS2, CELF2-DT, ECHDC3, GATA3, GATA3, GATA3-AS1, GATA3-AS1, GATA3-AS1, GATA3-AS1, GATA3-AS1, GATA3-AS1, LINC00708, LINC00709, LINC00710, LINC00710, LINC00710, LINC02670, LINC02676, LOC101928272, LOC105376398, LOC107984208, PROSER2, PROSER2-AS1, SFTA1P, TAF3, UPF2, UPF2, USP6NL, USP6NL, USP6NL"
10,12293281,13146132,852.851,del,"CAMK1D, CAMK1D, CAMK1D, CCDC3, CCDC3, MIR4480, MIR4481, MIR548Q, OPTN, OPTN, OPTN, OPTN"
10,13838825,14860845,1022.02,del,"CDNF, FAM107B, FAM107B, FAM107B, FAM107B, FAM107B, FAM107B, FAM107B, FAM107B, FAM107B, FAM107B, FAM107B, FAM107B, FAM107B, FAM107B, FAM107B, FAM107B, FAM107B, FRMD4A, FRMD4A, FRMD4A, FRMD4A, HSPA14, LOC100421372, LOC100421372, LOC101928453, MIR1265, MIR4293"
10,15263248,16793776,1530.528,del,"C1QL3, FAM171A1, ITGA8, ITGA8, MINDY3, MINDY3, PTER, PTER, PTER, PTER, PTER, RSU1, RSU1"
10,17279262,21803781,4524.519,del,"ARL5B, CACNB2, CACNB2, CACNB2, CACNB2, CACNB2, CACNB2, CACNB2, CACNB2, CACNB2, CACNB2, DNAJC1, HACD1, LINC02643, LOC101928834, MALRD1, MIR1915, MIR1915HG, MIR4675, MIR511, MLLT10, MLLT10, MLLT10, MLLT10, MLLT10, MLLT10, MLLT10, MLLT10, MRC1, NEBL, NEBL, NEBL, NEBL, NEBL, NEBL, NEBL, NEBL, NEBL, NEBL, NEBL-AS1, NEBL-AS1, NSUN6, NSUN6, NSUN6, NSUN6, NSUN6, PLXDC2, PLXDC2, SKIDA1, SLC39A12, SLC39A12, SLC39A12, SLC39A12, SLC39A12-AS1, ST8SIA6, ST8SIA6, ST8SIA6, ST8SIA6-AS1, STAM, STAM, STAM, STAM, STAM, STAM, STAM, STAM, STAM, STAM-AS1, TMEM236"
10,22056034,24761736,2705.702,del,"ARHGAP21, ARHGAP21, ARHGAP21, ARHGAP21, ARHGAP21, ARHGAP21, ARHGAP21, ARHGAP21, ARHGAP21, ARHGAP21, ARHGAP21, ARHGAP21, ARHGAP21, ARHGAP21, ARHGAP21, ARMC3, ARMC3, ARMC3, ARMC3, BMI1, C10orf67, C10orf67, C10orf67, C10orf67, COMMD3, COMMD3-BMI1, EBLN1, KIAA1217, KIAA1217, KIAA1217, KIAA1217, KIAA1217, KIAA1217, KIAA1217, LOC100130992, LOC100499489, LOC105376453, MIR603, MSRB2, OTUD1, PIP4K2A, PIP4K2A, PTF1A, SPAG6, SPAG6, SPAG6, SPAG6"
10,24924900,26355328,1430.428,del,"ENKUR, ENKUR, ENKUR, ENKUR, GAD2, GAD2, GPR158, GPR158-AS1, LINC00836, LINC00836, LINC00836, LINC01516, LOC101929073, MYO3A, MYO3A, PRTFDC1, PRTFDC1, THNSL1"
10,27703676,29746716,2043.04,del,"ARMC4, ARMC4, ARMC4, ARMC4, BAMBI, C10orf126, LINC00837, LINC00837, LINC00837, LINC01517, LINC02652, LYZL1, MIR604, MIR8086, MIR938, MKX, MKX, MKX-AS1, MPP7, MPP7, MPP7, MPP7, SNORD130, SVIL, SVIL, SVIL, SVIL, SVIL-AS1, SVIL-AS1, SVIL-AS1, SVIL-AS1, SVIL-AS1, SVIL-AS1, SVIL-AS1, SVIL-AS1, SVIL-AS1, SVIL-AS1, SVIL-AS1, WAC, WAC, WAC, WAC-AS1"
10,29844815,30314283,469.468,del,"JCAD, JCAD, JCAD, JCAD, LOC101929279, MTPAP"
10,31140109,38107068,6966.959,del,"ANKRD30A, ARHGAP12, ARHGAP12, ARHGAP12, ARHGAP12, ARHGAP12, ARHGAP12, CCDC7, CCDC7, CCDC7, CCDC7, CCDC7, CCNY, CCNY, CCNY, CCNY, CCNY, CREM, CREM, CREM, CREM, CREM, CREM, CREM, CREM, CREM, CREM, CREM, CREM, CREM, CREM, CREM, CREM, CREM, CREM, CREM, CREM, CREM, CREM, CREM, CREM, CREM, CREM, CREM, CREM, CREM, CREM, CREM, CUL2, CUL2, CUL2, CUL2, CUL2, CUL2, EPC1, EPC1, EPC1, EPC1, EPC1, EPC1, EPC1, EPC1, EPC1, EPC1, EPC1, EPC1, EPC1, EPC1, EPC1, EPC1, FZD8, GJD4, IATPR, ITGB1, ITGB1, ITGB1, KIF5B, LINC00838, LINC00993, LINC02664, LOC100505502, LOC101929431, LOC102031319, MIR3611, MIR4683, MTRNR2L7, NRP1, NRP1, NRP1, NRP1, NRP1, NRP1, NRP1, PARD3, PARD3, PARD3, PARD3, PARD3, PARD3, PARD3, PARD3, PARD3, PARD3, PARD3, PARD3-AS1, PCAT5, SNORA86, ZEB1, ZEB1, ZEB1, ZEB1, ZEB1, ZEB1, ZEB1, ZEB1, ZEB1, ZEB1, ZEB1, ZEB1, ZEB1, ZEB1, ZEB1, ZEB1, ZEB1, ZEB1, ZEB1, ZEB1, ZEB1, ZEB1, ZEB1, ZEB1, ZEB1, ZEB1, ZEB1, ZEB1, ZEB1, ZEB1, ZEB1, ZEB1, ZEB1, ZEB1, ZEB1, ZEB1, ZEB1, ZEB1, ZEB1, ZEB1, ZEB1, ZEB1-AS1, ZEB1-AS1, ZEB1-AS1, ZEB1-AS1, ZEB1-AS1, ZEB1-AS1, ZNF248, ZNF248, ZNF248, ZNF248, ZNF248, ZNF248, ZNF248, ZNF248, ZNF248, ZNF248, ZNF248, ZNF248, ZNF248, ZNF248, ZNF248, ZNF248, ZNF248, ZNF248, ZNF248, ZNF248, ZNF248, ZNF248, ZNF248, ZNF248, ZNF248, ZNF248, ZNF248, ZNF248, ZNF248, ZNF248, ZNF248, ZNF248, ZNF248, ZNF248, ZNF248, ZNF248, ZNF248, ZNF248, ZNF248, ZNF248, ZNF248, ZNF248, ZNF248, ZNF248, ZNF248, ZNF248, ZNF248, ZNF25, ZNF25, ZNF25, ZNF25, ZNF25, ZNF25, ZNF25, ZNF25, ZNF25, ZNF25, ZNF25, ZNF25, ZNF25, ZNF25, ZNF25, ZNF25, ZNF25, ZNF25, ZNF25, ZNF25, ZNF25, ZNF25, ZNF25, ZNF25, ZNF25, ZNF25, ZNF25, ZNF33A, ZNF33A, ZNF33A, ZNF33A, ZNF33A, ZNF33A, ZNF33A, ZNF33A, ZNF33A, ZNF33A, ZNF33A, ZNF33A, ZNF33A, ZNF33A, ZNF33A, ZNF33A, ZNF33A, ZNF33BP1, ZNF37A, ZNF37A, ZNF37A, ZNF37A, ZNF37A, ZNF37A, ZNF37A, ZNF37A, ZNF37A, ZNF37A, ZNF37A, ZNF37A, ZNF37A, ZNF37A, ZNF37A, ZNF37A, ZNF37A, ZNF37A, ZNF37A, ZNF37A"
10,38408370,43013970,4605.6,del,"ACTR3BP5, BMS1, CCNYL2, LINC00839, LINC00999, LINC01264, LINC01518, LINC01518, LINC01518, LINC01518, LINC02623, LOC105378269, LOC283028, LOC441666, MIR5100, ZNF33B, ZNF33B, ZNF33B, ZNF33B, ZNF33B, ZNF33B, ZNF33B, ZNF33B, ZNF33B, ZNF33B, ZNF33B, ZNF33B, ZNF37BP"
10,44142098,45422376,1280.278,del,"ALOX5, ALOX5, ALOX5, ALOX5, ALOX5, ANKRD30BP3, CXCL12, CXCL12, CXCL12, CXCL12, CXCL12, DEPP1, LINC02881, MIR3156-1, OR13A1, RASSF4, RSU1P2, TMEM72, TMEM72, TMEM72-AS1, ZNF22, ZNF22-AS1, ZNF22-AS1"
